Invacare Corporation,itu-295269,3/14/2018,2,"name, address, ssn, tax ID number",unauthorized access to email account
Sallie Mae,itu-295218,3/13/2018,,"name, address, ssn, dob, loan info",unauthorized access
Rotary International,itu-295266,3/13/2018,3,"name, ssn",unauthorized access to employee email
Rotary International,itu-295266 (update),3/13/2018,3,"name, ssn",unauthorized access to employee email
Atwood & Moore,itu-295380,3/12/2018,2,"name, address, dln, bank account info, payment card info",email account compromised
Manduka,itu-295333 (UPDATE - 2),3/27/2018,885,3/27/2018,malware
Manduka,itu-295333 (UPDATE),3/27/2018,885,3/27/2018,malware
"NFP Property & Casualty Services, Inc.",itu-295003,3/26/2018,35,"name, address, ssn, w2 tax info",phishing
"Branton, de Jong and Associates",itu-295295 (1),3/26/2018,4,"name, address, dob, ssn, tax info",unauthorized access
"Branton, de Jong and Associates",itu-295295 (2),3/26/2018,4,"name, address, dob, ssn, tax info",unauthorized access
"King & Associates CPA, P.C.",itu-295293,3/22/2018,17,"name, address, date of birth, wage information and withholding information, Drivers License number, bank account information and Social Security number.",unauthorized access
"Clinical Pathology Laboratories Southeast, Inc.",itu-295290 (2),3/21/2018,18,"name, address, Social Security number, drivers license or government identification number, financial account information, or medical treatment information",stolen laptop
"Clinical Pathology Laboratories Southeast, Inc.",itu-295290,3/21/2018,18,"name, address, Social Security number, drivers license or government identification number, financial account information, or medical treatment information",stolen laptop
"Orbitz Worldwide, Inc.",itu-295291 (1),3/21/2018,3607,"name, payment card info, dob, address",unauthorized access
"Orbitz Worldwide, Inc.",itu-295291 (2),3/21/2018,3607,"name, payment card info, dob, address",unauthorized access
"Hurst & Langlinais, Ltd.",itu-295292,3/21/2018,2,"name, birthdate, telephone number, address, Social Security number, tax info",unauthorized access
Cenlar FSB,itu-295287 (1),3/20/2018,1,"name, ssn, loan number",info improperly emailed to personal account
Cenlar FSB,itu-295287 (2),3/20/2018,1,"name, ssn, loan number",info improperly emailed to personal account
"Center for Comprehensive Services, Inc. d/b/a NeuroRestorative Maryland",itu-295289,3/20/2018,7,"name, ssn",unencrypted disk lost in mail
Connexus Credit Union,itu-295379,3/20/2018,6,"name, address, ssn, financial account numbers",phishing
Presti & Naegele,itu-295281,3/19/2018,,"name, address, ssn, tax info",unauthorized access
Bronson Nutritionals LLC,itu-295284,3/19/2018,375,"name, payment card info",malware
Nampa School District,itu-295387,3/16/2018,1,"name, address, ssn, financial account info",unauthorized access to email account
The Fireman Hospitality Group,itu-295274,3/16/2018,187,"name, address, ssn, w2 tax info",phishing
"Serene Sedation, LLC",itu-295275,3/16/2018,4327,"name, medical diagnosis, a Serene invoice tracking number",unauthorized access
Triage Consulting Group,itu-295276,3/16/2018,3,"name, address, ssn, w2 tax info",phishing
Clarfeld Financial Advisors,itu-295277,3/16/2018,12,"name, ssn, address, account number",unauthorized access
"UMH Properties, Inc.",itu-295270,3/15/2018,1,"name, address, earnings information, and Social Security number",info inadvertently emailed
"Island Outdoor, LLC",itu-295272,3/15/2018,17,"name, payment card info",malware
intuit Inc.,itu-295267,3/14/2018,175,"name, Social Security number, address, date of birth, drivers license number and financial information",unauthorized access
Invacare Corporation,itu-295269,3/14/2018,2,"name, address, ssn, tax ID number",unauthorized access to email account
Sallie Mae,itu-295218,3/13/2018,,"name, address, ssn, dob, loan info",unauthorized access
Rotary International,itu-295266,3/13/2018,3,"name, ssn",unauthorized access to employee email
Rotary International,itu-295266 (update),3/13/2018,3,"name, ssn",unauthorized access to employee email
Atwood & Moore,itu-295380,3/12/2018,2,"name, address, dln, bank account info, payment card info",email account compromised
Southpoint Financial Services,itu-295213,3/12/2018,5,"name, address, ssn, dln, bank account info",unauthorized access to email account
Nova Southeastern University,itu-295204,3/9/2018,4,"names, Social Security numbers, dates of birth, and, in some cases, passport numbers",phishing
Academy Mortgage Corporation,itu-295205,3/9/2018,7,"name, payroll info, direct deposit info",phishing
"Anchor Fund, LLC",itu-295206,3/9/2018,1,"name, address, ssn, account number",info inadvertently sent to wrong recipient
"Draper and Kramer, Inc.",itu-295202,3/8/2018,69,"name, ssn, dln, passport number, payment card info",unauthorized access
ICF,itu-295383,3/7/2018,71,"name, address, w2 info, ssn",info emailed to unauthorized recipient
"CNU Online Holdings, LLC and its subsidiaries, collectively d/b/a NetCredit",itu-295185,3/7/2018,24,"ame, telephone number, physical address, last four digits of their bank account number, NetCredit account number, last four digits of their Social Security number, and basic employment and income information",unauthorized access
"CNU Online Holdings, LLC and its subsidiaries, collectively d/b/a NetCredit",itu-295185 (2),3/7/2018,24,"ame, telephone number, physical address, last four digits of their bank account number, NetCredit account number, last four digits of their Social Security number, and basic employment and income information",unauthorized access
"Williams-Sonoma, Inc.",itu-295187 (1),3/7/2018,1,"name, payment card info",info improperly retained by employee
"Williams-Sonoma, Inc.",itu-295187 (2),3/7/2018,1,"name, payment card info",info improperly retained by employee
Personal Care Products Council,itu-295201 (1),3/7/2018,33,"name, address, dob, ssn, compensation info",info inadvertently emailed to wrong recipient
Personal Care Products Council,itu-295201 (2),3/7/2018,33,"name, address, dob, ssn, compensation info",info inadvertently emailed to wrong recipient
Badger Daylighting Ltd.,itu-295384,3/6/2018,5,"name, ssn",info inadvertently mailed to wrong recipient
"Citizens Financial Group, Inc.",itu-295171 (1),3/6/2018,1,"name, ATM/debit card info",skimmer
"Citizens Financial Group, Inc.",itu-295171,3/6/2018,1,"name, ATM/debit card info",skimmer
M&E Tax and Financial Services,itu-295172,3/6/2018,300,"name, address, tax info, dob, financial info",ransomware
Geisinger Health System,itu-295173 (1),3/6/2018,39,"name, ssn, dob",ransomware
Geisinger Health System,itu-295173 (2),3/6/2018,39,"name, ssn, dob",ransomware
Geisinger Health System,itu-295173 (3),3/6/2018,39,"name, ssn, dob",ransomware
Geisinger Health System,itu-295173 (4),3/6/2018,39,"name, ssn, dob",ransomware
CHROME Federal Credit Union,itu-295174,3/6/2018,,,unauthorized access by former employees
"Interstate Plastics, Inc.",itu-295177,3/6/2018,16,"name, payment card info",malware
"California State University, Fresno",itu-295182,3/6/2018,35,"name, address, ssn, dln, financial account info, health info",info stolen during break-in
"Chopra Enterprises, LLC",itu-295184,3/6/2018,14,"name, payment card info",unauthorized access
"Chopra Enterprises, LLC",itu-295184 (2),3/6/2018,14,"name, payment card info",unauthorized access
Preferred Hotels & Resorts,itu-295385,3/5/2018,,"name, payment card info",unauthorized access
intuit Inc.,itu-295165,3/5/2018,19,"name, Social Security number, address, date of birth, drivers license number and financial information",unauthorized access
intuit Inc.,itu-295167,3/5/2018,84,"name, Social Security number, address, date of birth, drivers license number and financial information",unauthorized access
"Waccamaw Management, LLC",itu-295169,3/5/2018,1,"name, address, ssn, w2 tax info",phishing
"Fairchild Maddox & Leonidas, Ltd.",itu-295142,3/2/2018,1,"name, address, dob, ssn, financial account info",unauthorized access
"Remington Hotels, LLC",itu-295143,3/2/2018,2,"name, address, ssn, w2 tax info",phishing
Parkway Corporation,itu-295144,3/2/2018,6,"name, address, ssn, w2 tax info",phishing
State Employee Credit Union of Maryland,itu-295145,3/2/2018,,"name, payment card info",skimmer
Bed Bath & Beyond Inc.,itu-295119,3/1/2018,6,,improper access by call center employee
"ABC Bus Companies, Inc.",itu-295138,3/1/2018,,"name, address, dob",phishing
"Beachbody, LLC",itu-295139,3/1/2018,22,"name, ssn",tax forms mailed to wrong recipients
ASI Construction LLC,itu-295140,3/1/2018,7,"name, ssn, w2 tax info",phishing
Centris Federal Credit Union,itu-295141,3/1/2018,7,"name, ssn",unauthorized access
"Lydia Security Monitoring, d/b/a COPS Monitoring",itu-295055,2/28/2018,186,"name, address, ssn, w2 tax info",phishing
Principal Financial Group,itu-295079 (1),2/28/2018,1,"name, ssn",info inadvertently sent to wrong recipient
Principal Financial Group,itu-295079 (2),2/28/2018,1,"name, ssn",info inadvertently sent to wrong recipient
Caroline County,itu-295084,2/28/2018,,"name, address, ssn, w2 tax info",phishing
Cary E. Williams CPA,itu-295086,2/28/2018,2,"full name, address, Social Security number, and earnings information",ransomware
FastHealth Corporation,itu-295014,2/27/2018,,"name, dob, ssn, dln, payment card info, health insurance info",unauthorized acecss
Mercy Health Love County Hospital and Clinic,itu-295077,2/27/2018,3,"name, address or other demographic, clinical or billing information",unable to confirm old computer was destroyed
"ALCOVA Mortgage, LLC",itu-295075,2/26/2018,9,"name, ssn, bank account info, payment card info, dln",unauthorized access to email account
California College of the Arts,itu-295076,2/26/2018,6,"name, ssn",stolen laptop
"Jemison Internal Medicine, PC",itu-295107,2/26/2018,1,"name, address, ssn, dob, dln, treatment and medical info",ransomware
Cedarville University,itu-295108,2/26/2018,2,"name, ssn address, wage info",software error
Abeles & Hoffman P.C.,itu-295110,2/26/2018,1,"name, ssn",phishing
North 40 Outfitters,itu-295065,2/23/2018,105,payment card info,malware
"Coastal Cape Fear Eye Associates, P.A",itu-295071 (1),2/23/2018,1,"name, email address, phone number, mailing address, Social Security Number, medical history, medications, legal documents, diagnosis records, physician notes, and billing and payment histories, as well as insurance information and driver's license information",ransomware
"Coastal Cape Fear Eye Associates, P.A",itu-295071 (2),2/23/2018,1,"name, email address, phone number, mailing address, Social Security Number, medical history, medications, legal documents, diagnosis records, physician notes, and billing and payment histories, as well as insurance information and driver's license information",ransomware
Summit Inspection Services,itu-295072 (1),2/23/2018,3,"name, ssn, dln, bank account info",unauthorized access
Summit Inspection Services,itu-295072 (2),2/23/2018,3,"name, ssn, dln, bank account info",unauthorized access
ACTIVE Network,itu-295073 (1),2/23/2018,6,"name, payment card info, address",malware
ACTIVE Network,itu-295073 (2),2/23/2018,6,"name, payment card info, address",malware
Cruzstart LLC d.b.a. MenuDrive,itu-295114,2/23/2018,,"name, payment card info, address",unauthorized access
Marriott International Inc.,itu-295059 (2),2/22/2018,3,"name, w2 tax info, direct deposit info",unauthorized access
Marriott International Inc.,itu-295059,2/22/2018,3,"name, w2 tax info, direct deposit info",unauthorized access
University of Wisconsin-Superior Alumni Association,itu-295060,2/22/2018,,"name, ssn (student ID number)",system error
intuit Inc.,itu-295061,2/22/2018,149,"name, Social Security number, address, date of birth, drivers license number and financial information",unauthorized access
"Musicians On Call, Inc.",itu-295062,2/22/2018,33,"names, phone number and/or address, drivers license numbers, passport numbers, ssn",stolen laptop
The Meridian Group,itu-295063,2/22/2018,13,"name, date of birth, address, Social Security Number, and financial account information",phishing
"Santa Cruz Biotechnology, Inc.",itu-295064 (1),2/22/2018,5,"full name, postal address, date of birth, Social Security number, medical and health insurance information, and work-related evaluations.",computers stolen during burglary
"Santa Cruz Biotechnology, Inc.",itu-295064 (2),2/22/2018,5,"full name, postal address, date of birth, Social Security number, medical and health insurance information, and work-related evaluations.",computers stolen during burglary
Transamerica,itu-295112,2/22/2018,,,unauthorized access
Transamerica,itu-295112 UPDATE (1),2/22/2018,,,unauthorized access
Transamerica,itu-295112 UPDATE (2),2/22/2018,,,unauthorized access
JJ Haines,itu-295056,2/21/2018,,"name, address, ssn, w2 tax info",phishing
"The Vanguard Group, Inc.",itu-295058,2/21/2018,1,,inadvertent human error
ASCD,itu-298392 (UPDATE),2/21/2018,43,"name, address, ssn",spearphishing
ASCD,itu-298392,2/21/2018,43,"name, address, ssn",spearphishing
"Rockville Eye Surgery Center, LLC dba Palisades Surgery Center",itu-295057,2/20/2018,2,"name, ssn, address, medical info",unauthorized access
iMiller Public Relations LLC,itu-295111,2/20/2018,1,"name, ssn",phishing
Belmont Savings Bank,itu-295118,2/20/2018,1,"name, ssn",unencrypted computer inadvertently discarded
"Allied Contractors, Inc.",itu-295037,2/16/2018,,"name, address, ssn, w2 tax info",phishing
"Perry & Associates, CPA's, A.C.",itu-295116,2/16/2018,7,"name, ssn, dln, bank account info",malware
Bed Bath & Beyond Inc.,itu-295136,2/15/2018,4,"name, payment card info",improper access by call center employee
"LendKey Technologies, Inc.",itu-295039,2/15/2018,256,"name, dob, ssn, dln",info inadvertently accessible to the internet
Bed Bath & Beyond Inc.,itu-295102,2/15/2018,,"name, address, ssn, dln, direct deposit info",file cabinet inadvertently discarded during a remodel
ghg | GreyHealth Group,itu-295115,2/15/2018,,"name, address, ssn, salary info",phishing
Engle Martin & Associates,itu-295041,2/14/2018,5,"name, address, ssn, bank account info, payment card info, health insurance info",compromised email account
"Trout, Ebersole & Groff LLP",itu-295044,2/14/2018,6,"name, ssn",phishing
Palo Alto Unified School District,itu-295046,2/14/2018,2,"name, address, dob",improperly stored on laptop
Flexible Benefit Service Corporation,itu-295047,2/14/2018,21,"name, dob, ssn, medical info, health insurance info",phishing
"Norwich Commercial Group, Inc. dba Norcom Mortgage",itu-295101,2/14/2018,33,"name, ssn, bank account info, dln",unauthorized access to employee email
"Medical science & Computing, LLC",itu-295048,2/13/2018,104,"name, address, ssn, w2 tax info",info inadvertently emailed to wrong recipient
PACCAR,itu-295049,2/13/2018,,"name, ssn, credit application, dob, dln",stolen laptop
Eastern Shore Rural Health Inc.,itu-295051,2/13/2018,8,"name, ssn, w2 tax info, address",unauthorized access
Driscoll's Inc.,itu-295100,2/13/2018,2,"name, ssn",phishing
SunTrust Bank,itu-295040,2/12/2018,,"name, address, account number, dob, ssn",improper access by former employee
1st Mariner Bank,itu-295050 (1),2/12/2018,558,"name, payment card info",skimming device
1st Mariner Bank,itu-295050 (2),2/12/2018,558,"name, payment card info",skimming device
Thomas Edison State University,itu-295054 (update),2/12/2018,12,"name, ssn",unauthorized access to email
Thomas Edison State University,itu-295054,2/12/2018,12,"name, ssn",unauthorized access to email
Inspire Home Loans Inc.,itu-294967,2/9/2018,10,"name, address, ssn",unauthorized access to email
COUNTRY Mutual Insurance Company,itu-294968,2/9/2018,4,"name, address, ssn, policy and account numbers",info lost in transit
Fontainebleau Miami Beach,itu-294969,2/8/2018,3,"name, payment card info",unauthorized access
"Corporate Employment Resources, Inc.",itu-294970,2/8/2018,,"name, ssn",info inadvertently included in email
"TrueNet Communications, Inc.",itu-295094,2/8/2018,161,"name, ssn",unauthorized access to employee email
DSW Inc.,itu-294971,2/7/2018,1,"name, ssn, dob, address, wage info, bank info",phishing
"Kinetics Systems, Inc.",itu-294972 (1),2/6/2018,106,"name, address, ssn, w-2 tax info",phishing
"Kinetics Systems, Inc.",itu-294972 (2),2/6/2018,106,"name, address, ssn, w-2 tax info",phishing
"OneMain Financial Group, LLC",itu-294973,2/6/2018,12,"name, address, account number, insurance info",unauthorized access
Aflac,itu-294982 (1),2/6/2018,1,"name, ssn",compromised email account
Aflac,itu-294982 (2),2/6/2018,1,"name, ssn",compromised email account
Montgomery County,itu-295092,2/6/2018,5,,unauthorized access
Valley of the Sun YMCA,itu-295097,2/6/2018,1,"name, dln",phishing
Aflac,itu-294982 (update),2/6/2018,1,"name, ssn",compromised email account
Aflac,itu-294982 (1) (update),2/6/2018,1,"name, ssn",compromised email account
Aflac,itu-294982 (2) (update),2/6/2018,1,"name, ssn",compromised email account
Aflac,itu-294982 (3) (update),2/6/2018,1,"name, ssn",compromised email account
"PAR Electrical Contractors, Inc.",itu-294987,2/5/2018,144,"name, ssn, tax info, payroll info. dob",stolen backup tapes
1st Mariner Bank,itu-294989,2/5/2018,929,"name, Social Security number, financial account information, credit or debit card information, drivers license number or state identification card number and individual taxpayer identification number",phishing
Kennedy Krieger Institute,itu-294990,2/5/2018,,"name, address, ssn, w-2 tax info",info inadvertently sent to wrong recipient
Caliber Collision Centers,itu-295090,2/5/2018,1,"name, address, dob, ssn",phishing
"MidCap Financial Services, LLC",itu-295096,2/5/2018,2,"name, ssn",unauthorized access to employee email
The Prudential Insurance Company of America,itu-295099,2/5/2018,,"name, address, dob, ssn",unauthorized access
Doral Corporation,itu-294992,2/2/2018,2,"name, address, ssn, w-2 tax info",phishing/ spoofing
Make-up Designory,itu-294996,2/2/2018,6,"name, address, ssn, tuition info",human error resulting in info mailed to wrong recipient
"Ventiv Technology, Inc.",itu-294998,2/1/2018,3,"name, ssn",compromised email account
"Advanced Graphic Products, Inc.",itu-294999 (1),2/1/2018,12,"name, address, payment card info",unauthorized access
"Advanced Graphic Products, Inc.",itu-294999 (2),2/1/2018,12,"name, address, payment card info",unauthorized access
Duquesne University,itu-294966,1/31/2018,6,"name, ssn",info inadvertently emailed to wrong recipient
"Eagle Bancorp, Inc.",itu-295008,1/31/2018,2,,stolen laptop
"Visit Baltimore, Inc.",itu-295036,1/31/2018,118,"name, address, ssn, wage info, w2 tax info",phishing
"Eagle Bancorp, Inc.",itu-295008 (update),1/31/2018,2,,stolen laptop
Lonza,itu-295035,1/30/2018,3,"name, address, dob, payroll info",phishing
Saginaw Valley State University,itu-295093,1/30/2018,15,"name, ssn",stolen laptop
"Pentair Aquatic Eco Systems, Inc.",itu-295026,1/29/2018,5,"name, payment card info",malware
"Member First Mortgage, LLC",itu-295030,1/29/2018,10,"name, ssn, address, mortgage account info",unauthorized access to email account
"Goldleaf Partners Services, Inc.",itu-294964,1/26/2018,11,"name, dob, address, ssn, financial account info",phishing
RBC Royal Bank,itu-294965 (1),1/26/2018,,"name, payment card info",unauthorized access
RBC Royal Bank,itu-294965 (2),1/26/2018,,"name, payment card info",unauthorized access
RBC Royal Bank,itu-294965 (3),1/26/2018,,"name, payment card info",unauthorized access
Aberdeen Proving Ground Federal Credit Union,itu-295029,1/26/2018,36,"name, ssn",human error in inadvertently including info in an email
RBC Royal Bank,itu-294965 (update 1),1/26/2018,,"name, payment card info",unauthorized access
RBC Royal Bank,itu-294965 (update 2),1/26/2018,,"name, payment card info",unauthorized access
National Registry of Emergency Medical Technicians,itu-294963,1/25/2018,1,"name, ssn",unauthorized access
Educational Testing Service,itu-295025,1/25/2018,6,"name, ssn",compromised email account
"KLX, Inc.",itu-295033,1/25/2018,3,"name, ssn, salary info",stolen laptop
"VSA Partners, Inc.",itu-294962,1/24/2018,2,"name, ssn",unauthorized access to employee email account
"Makeup Geek, LLC",itu-295023,1/23/2018,38,"name, payment card info",malware
"Tx:Team Rehab, Inc.",itu-294959,1/22/2018,3,"name, ssn",unauthorized access to employee email
"National Stores, Inc.",itu-294960 (1),1/22/2018,,"name, payment card info",malware
"National Stores, Inc.",itu-294960 (2),1/22/2018,,"name, payment card info",malware
"National Stores, Inc.",itu-294960 (3),1/22/2018,,"name, payment card info",malware
The Coca-Cola Company,itu-295022,1/22/2018,14,"name, ssn, payment card info",phishing
"Mindlance, Inc.",itu-294950 (1),1/19/2018,,"name, ssn",unauthorized access / stolen info
"Mindlance, Inc.",itu-294950 (2),1/19/2018,,"name, ssn",unauthorized access / stolen info
Rosewood Hotel Group,itu-294951,1/19/2018,114,"name, payment card info",unauthorized access
"Westminster Ingleside King Farm Presbyterian Retirement Communities, Inc.",itu-294952,1/19/2018,2795,"name, address, dob, ssn, financial info",malware
Employer Leasing Company,itu-294953,1/18/2018,3,"name, address, ssn, dln, health insurance info",info inadvertently accessible online
"Seterus, Inc.",itu-294954 (1),1/18/2018,2,"name, loan info, address",mailing error
"Seterus, Inc.",itu-294954 (2),1/18/2018,2,"name, loan info, address",mailing error
"HSBC Mortgage Services, Inc.",itu-294955 (1),1/18/2018,1,"name, address, ssn, loan info",inadvertently emailed to wrong recipient
"HSBC Mortgage Services, Inc.",itu-294955 (2),1/18/2018,1,"name, address, ssn, loan info",inadvertently emailed to wrong recipient
Anchorage School District,itu-294956,1/17/2018,,"name, ssn, dln, payment card info",phishing
Securadyne Systems LLC,itu-294957,1/16/2018,1,"name, address, payment card info",phishing
Pension Fund of the Christian Church,itu-294958,1/16/2018,294,"name, dob, ssn, id numbers",stolen laptop and unauthorized access to server to mine for crypto currency
Nationstar Mortgage LLC d/b/a Mr. Cooper,itu-294936,1/12/2018,1,"name, loan number, address",info inadvertently sent to wrong recipient
"Guaranteed Rate, Inc.",itu-294937,1/12/2018,1406,"name, address, dln, financial account info",phishing
"Rea.deeming Beauty, Inc. dba beautyblender",itu-294938,1/12/2018,364,"name, address, payment card info",malware
Hallmark Home Mortgage,itu-294939,1/12/2018,6,"name, ssn, dln, financial account info",unauthorized access by former employee
Monticello Central School District,itu-294940,1/12/2018,1,"name, address, dob, ssn",phishing
PharMerica Corporation,itu-294941,1/12/2018,737,"demographic information, medication and clinical information, health insurance information and Social Security numbers",unauthorized access to email account
"Deli Management, Inc.",itu-294942,1/11/2018,56400,"name, payment card info",malware
"Deli Management, Inc.",itu-294942 (UPDATE),1/11/2018,56400,"name, payment card info",malware
"talentReef, Inc.",itu-294943,1/10/2018,185,"name, address, dln, ssn, payment card info",unauthorized access to employee email account
Broward College,itu-294944,1/10/2018,145,"name, dob, address, ssn, financial account info, payment card info, dln",phishing
Alton Lane,itu-294945 (1),1/10/2018,43,"name, address, payment card info",malware
Alton Lane,itu-294945 (2),1/10/2018,43,"name, address, payment card info",malware
Multnomah Athletic Club,itu-295020,1/9/2018,14,"name, ssn, bank account info",stolen shredding bins
"Friedman, Leavitt & Associates, Inc.",itu-295021,1/9/2018,2,"name, address, ssn, dob",unauthorized access
Cetera Advisors LLC,itu-294946,1/8/2018,29,"name, address, ssn",unauthorized access to employee email account
Nationstar Mortgage LLC d/b/a Mr. Cooper,itu-294947,1/8/2018,1,"name, address, loan info",info inadvertently sent to wrong recipient
Lincoln Financial Group,itu-294948 (1),1/5/2018,1,"name, ssn, account number",inadvertent human error
Lincoln Financial Group,itu-294948 (2),1/5/2018,1,"name, ssn, account number",inadvertent human error
Lincoln Financial Group,itu-294948 (3),1/5/2018,1,"name, ssn, account number",inadvertent human error
Lincoln Financial Group,itu-294948 (4),1/5/2018,1,"name, ssn, account number",inadvertent human error
"Mattress Firm, Inc.",itu-294949,1/3/2018,1,"name, direct deposit info, ssn",phishing
,itu-294899,,,,
"Eagle Bankcorp, Inc.",itu-292509,1/31/2018,1,"name, dob, dln, ssn",stolen laptop
"Equifax Consumer Services, LLC",itu-292504,1/29/2018,2,"email address, username, password, credit report, last four digits of ssn, address",unauthorized access
Zachary E. Adkins DDS,itu-292496,1/25/2018,,"name, address, ssn, dob",stolen laptop
Mid-Atlantic Carpenters' Training Center,itu-294707,12/29/2017,1357,"name, address, ssn, dln",unauthorized access to email
"Forever 21, Inc.",itu-294709,12/28/2017,,"name, payment card info",malware
NextGen Global Resources,itu-294710,12/28/2017,3,"name, ssn, don,",phishing
michael saunders & company,itu-294816,12/27/2017,11,"name, ssn, address, dln",phishing
"TIO Networks USA, Inc.",itu-294821,12/27/2017,,"name, payment card info, bank info, ssn",unauthorized access
michael saunders & company,itu-294816 (Update),12/27/2017,11,"name, ssn, address, dln",phishing
"TIO Networks USA, Inc.",itu-294821 (update),12/27/2017,,"name, payment card info, bank info, ssn",unauthorized access
The Valerie Fund,itu-291919 ,12/26/2017,1,"name, Social Security number, and date of birth",ransomware
TIAA-CREF,itu-294711,12/26/2017,1,"name, ssn",inadvertently emailed to wrong recipient
The Boeing Company,itu-294813,12/26/2017,28,"name, ssn",inadvertently emailed to wrong recipient
"LiveGlam, Inc.",itu-294814,12/26/2017,,"name, payment card info, address",unauthorized access
"Brazos Higher Education Service Corporation, Inc.",itu-294815,12/26/2017,17,"name, ssn, loan info",info inadvertently emailed
Howard Bank,itu-294867,12/26/2017,7,"name, address, ssn, dob",improper use of data by employee
"Wawa, Inc.",itu-294806,12/22/2017,,"name, address, ssn, dob",phishing
