Company Name,clean_name,Company Type,D-U-N-S@ Number,Manufacturing Indicator,Subsidiary Status,Year of Founding,Location Type,Physical State,Primary NAICS Code,Primary NAICS Description,Secondary NAICS Code,Secondary NAICS Description,Secondary SIC Code,Secondary SIC Description,Primary SIC Code,Primary SIC Description,Sales,Employee All Sites,Employee this Site,Sales (Year 1)
JPMORGAN CHASE & CO.,JPMorgan Chase & Co,Public,04-767-5947,Manufacturer,Non-Subsidiary,1968,Headquarters,NEW YORK,522110,Commercial Banking,"522110, 522291, 522390, 523120","""Commercial Banking "", ""Consumer Lending "", ""Other Activities Related to Credit Intermediation "", ""Securities Brokerage ""","6021, 6141, 6162, 6211","""National commercial banks"", ""Personal credit institutions"", ""Mortgage bankers and correspondents"", ""Security brokers and dealers""",60210000,National commercial banks,"$142,422,000,000 ","256,981",141,"$131,412,000,000 "
THE BOEING COMPANY,Boeing Co,Public,00-925-6819,Non Manufacturer,Non-Subsidiary,1916,Headquarters,ILLINOIS,336411,Aircraft Manufacturing,"334220, 334511, 336411, 336413, 336414, 336415","""Radio and Television Broadcasting and Wireless Communications Equipment Manufacturing"", ""Search, Detection, Navigation, Guidance, Aeronautical, and Nautical System and Instrument Manufacturing "", ""Aircraft Manufacturing "", ""Other Aircraft Parts and Auxiliary Equipment Manufacturing "", ""Guided Missile and Space Vehicle Manufacturing "", ""Guided Missile and Space Vehicle Propulsion Unit and Propulsion Unit Parts Manufacturing ""","3663, 3721, 3728, 3761, 3764, 3812","""Radio & TV communications equipment"", ""Aircraft"", ""Aircraft parts and equipment, nec"", ""Guided missiles and space vehicles"", ""Space propulsion units and parts"", ""Search and navigation equipment""",37210101,"Airplanes, fixed or rotary wing","$76,559,000,000 ","161,100",210,"$101,127,000,000 "
"METLIFE, INC.",Methodist Theological School in Ohio,Public,11-215-8568,Manufacturer,Non-Subsidiary,1863,Headquarters,NEW YORK,524113,Direct Life Insurance Carriers,"524113, 524114, 524126","""Direct Life Insurance Carriers "", ""Direct Health and Medical Insurance Carriers "", ""Direct Property and Casualty Insurance Carriers ""","6311, 6321, 6331","""Life insurance"", ""Accident and health insurance"", ""Fire, marine, and casualty insurance""",63119906,Life insurance carriers,"$69,620,000,000 ","49,000",16,"$67,941,000,000 "
HUMANA INC.,HSBC Retail Services,Public,04-994-4143,Manufacturer,Non-Subsidiary,1961,Headquarters,KENTUCKY,524114,Direct Health and Medical Insurance Carriers,"524114, 524292","""Direct Health and Medical Insurance Carriers "", ""Third Party Administration of Insurance and Pension Funds ""","6321, 6324, 6411","""Accident and health insurance"", ""Hospital and medical service plans"", ""Insurance agents, brokers, & service""",63210102,Health insurance carriers,"$64,888,000,000 ","43,600",57,"$56,912,000,000 "
LOCKHEED MARTIN CORPORATION,Lockheed Martin Corp,Public,83-495-1691,Non Manufacturer,Non-Subsidiary,1995,Headquarters,MARYLAND,336414,Guided Missile and Space Vehicle Manufacturing,"334220, 334511, 336411, 336413, 336414, 336415","""Radio and Television Broadcasting and Wireless Communications Equipment Manufacturing"", ""Search, Detection, Navigation, Guidance, Aeronautical, and Nautical System and Instrument Manufacturing "", ""Aircraft Manufacturing "", ""Other Aircraft Parts and Auxiliary Equipment Manufacturing "", ""Guided Missile and Space Vehicle Manufacturing "", ""Guided Missile and Space Vehicle Propulsion Unit and Propulsion Unit Parts Manufacturing ""","3663, 3721, 3728, 3761, 3764, 3812","""Radio & TV communications equipment"", ""Aircraft"", ""Aircraft parts and equipment, nec"", ""Guided missiles and space vehicles"", ""Space propulsion units and parts"", ""Search and navigation equipment""",37619905,"Space vehicles, complete","$59,812,000,000 ","105,000",400,"$53,762,000,000 "
"BEST BUY CO., INC.",Best Buy Co Inc,Public,02-305-8159,Manufacturer,Non-Subsidiary,1966,Headquarters,MINNESOTA,443142,Electronics Stores,"337110, 443141, 443142","""Wood Kitchen Cabinet and Countertop Manufacturing"", ""Household Appliance Stores "", ""Electronics Stores ""","5712, 5722, 5731, 5734, 5735","""Furniture stores"", ""Household appliance stores"", ""Radio, TV, & electronic stores"", ""Computer and software stores"", ""Record & prerecorded tape stores""",57340000,Computer and software stores,"$43,638,000,000 ","125,000",102,"$42,879,000,000 "
"MACY'S, INC.","MA Department of Revenue, Office of the Commissioner",Public,00-698-7135,Manufacturer,Non-Subsidiary,1830,Headquarters,OHIO,452210,Department Stores,452210,"""Department Stores """,5311,"""Department stores""",53119902,"Department stores, non-discount","$25,331,000,000 ","130,000",650,"$25,739,000,000 "
OCCIDENTAL PETROLEUM CORPORATION,Occidental Petroleum Corp,Public,00-690-8354,Manufacturer,Non-Subsidiary,1920,Headquarters,TEXAS,211120,Crude Petroleum Extraction ,"211120, 213112","""Crude Petroleum Extraction "", ""Support Activities for Oil and Gas Operations ""","1311, 1382","""Crude petroleum and natural gas"", ""Oil and gas exploration services""",13110101,Crude petroleum production,"$21,232,000,000 ","11,000","1,000","$18,934,000,000 "
"NORDSTROM, INC.",Nix Check Cashing,Public,00-794-2915,Manufacturer,Non-Subsidiary,1901,Headquarters,WASHINGTON,448140,Family Clothing Stores,"448110, 448130, 448140, 448150, 448210, 454110","""Men's Clothing Stores "", ""Children's and Infants' Clothing Stores "", ""Family Clothing Stores "", ""Clothing Accessories Stores "", ""Shoe Stores "", ""Electronic Shopping and Mail-Order Houses ""","5611, 5632, 5641, 5651, 5661, 5961","""Men's & boys' clothing stores"", ""Women's accessory & specialty stores"", ""Children's and infants' wear stores"", ""Family clothing stores"", ""Shoe stores"", ""Catalog and mail-order houses""",56510000,Family clothing stores,"$15,132,000,000 ","68,000",97,"$15,860,000,000 "
"BLACKROCK, INC.",BlackRock Inc,Public,78-698-7052,Manufacturer,Non-Subsidiary,1988,Headquarters,NEW YORK,525910,Open-End Investment Funds,"523930, 525910","""Investment Advice "", ""Open-End Investment Funds ""","6282, 6722","""Investment advice"", ""Management investment, open-end""",67229901,Money market mutual funds,"$14,539,000,000 ","14,900",100,"$14,198,000,000 "
NEWS CORPORATION,News Corp,Public,07-882-6673,Non Manufacturer,Non-Subsidiary,2012,Headquarters,NEW YORK,511130,Book Publishers,"511110, 511130, 519190","""Newspaper Publishers "", ""Book Publishers "", ""All Other Information Services""","2711, 2731, 7375","""Newspapers"", ""Book publishing"", ""Information retrieval services""",27310000,Book publishing,"$10,074,000,000 ","28,000",133,"$9,024,000,000 "
"HENRY SCHEIN, INC.",Helen Grace Chocolates Inc,Public,01-243-0880,Manufacturer,Non-Subsidiary,1932,Headquarters,NEW YORK,423450,"Medical, Dental, and Hospital Equipment and Supplies Merchant Wholesalers","423450, 424210, 511210","""Medical, Dental, and Hospital Equipment and Supplies Merchant Wholesalers "", ""Drugs and Druggists' Sundries Merchant Wholesalers "", ""Software Publishers""","5047, 5122, 7372","""Medical and hospital equipment"", ""Drugs, proprietaries, and sundries"", ""Prepackaged software""",50470200,Dental equipment and supplies,"$9,985,803,000 ","22,000",700,"$13,201,995,000 "
HILTON WORLDWIDE HOLDINGS INC.,Hilton Worldwide Holding Inc,Public,07-913-2993,Manufacturer,Non-Subsidiary,1919,Headquarters,VIRGINIA,721110,Hotels (except Casino Hotels) and Motels,"533110, 721110","""Lessors of Nonfinancial Intangible Assets (except Copyrighted Works)"", ""Hotels (except Casino Hotels) and Motels ""","6794, 7011","""Patent owners and lessors"", ""Hotels and motels""",70110300,Hotels,"$9,452,000,000 ","169,000",363,"$8,906,000,000 "
"COMPASS GROUP USA, INC.",Community College System of NH,Private,61-170-1327,Manufacturer,Subsidiary,1929,Headquarters,NORTH CAROLINA,722310,Food Service Contractors,"541611, 722310","""Administrative Management and General Management Consulting Services "", ""Food Service Contractors""","5812, 8742","""Eating places"", ""Management consulting services""",58129906,Contract food services,"$9,098,790,996 ","230,000","1,000","$11,181,485,775 "
"RAYMOND JAMES FINANCIAL, INC.",Raymond James Financial Inc,Public,07-759-2889,Manufacturer,Non-Subsidiary,1962,Headquarters,FLORIDA,523120,Securities Brokerage,523120,"""Securities Brokerage """,6211,"""Security brokers and dealers""",62110102,"Brokers, security","$8,023,000,000 ","14,200",230,"$7,475,821,000 "
"MOTOROLA SOLUTIONS, INC.",Motorola Inc,Public,00-132-5463,Non Manufacturer,Non-Subsidiary,1928,Headquarters,ILLINOIS,334220,Radio and Television Broadcasting and Wireless Communications Equipment Manufacturing,"334210, 334220","""Telephone Apparatus Manufacturing"", ""Radio and Television Broadcasting and Wireless Communications Equipment Manufacturing""","3661, 3663","""Telephone and telegraph apparatus"", ""Radio & TV communications equipment""",36630100,Radio broadcasting and communications equipment,"$7,887,000,000 ","17,000",225,"$7,343,000,000 "
"HSBC BANK USA, NATIONAL ASSOCIATION",HSBC,Private,82-587-1820,Manufacturer,Subsidiary,1990,Headquarters,VIRGINIA,522110,Commercial Banking,,,,,60290000,"Commercial banks, nec","$6,522,507,000 ",17,17,"$5,722,339,000 "
NAVY FEDERAL CREDIT UNION,Navy Federal Credit Union,Private,06-926-9975,Manufacturer,Non-Subsidiary,1933,Headquarters,VIRGINIA,522130,Credit Unions,522130,"""Credit Unions """,6061,"""Federal credit unions""",60610000,Federal credit unions,"$5,390,195,249 ","6,037","3,198","$4,632,749,447 "
"BROADRIDGE FINANCIAL SOLUTIONS, INC.",Bristol Savings Bank,Public,60-853-7960,Manufacturer,Non-Subsidiary,1962,Headquarters,NEW YORK,518210,"Data Processing, Hosting, and Related Services","511210, 518210","""Software Publishers"", ""Data Processing, Hosting, and Related Services""","7372, 7374","""Prepackaged software"", ""Data processing and preparation""",73740000,Data processing and preparation,"$4,362,200,000 ","11,000",148,"$4,329,900,000 "
EQUIFAX INC.,Enterprise Bank,Public,04-581-2369,Manufacturer,Non-Subsidiary,1899,Headquarters,GEORGIA,522320,"Financial Transactions Processing, Reserve, and Clearinghouse Activities","522320, 541910, 561110, 561450","""Financial Transactions Processing, Reserve, and Clearinghouse Activities "", ""Marketing Research and Public Opinion Polling"", ""Office Administrative Services"", ""Credit Bureaus""","7323, 7389, 8732, 8741","""Credit reporting services"", ""Business services, nec"", ""Commercial nonphysical research"", ""Management services""",73890900,Financial services,"$3,507,600,000 ","10,900",112,"$3,412,100,000 "
"CATALENT PHARMA SOLUTIONS, INC.",Catalent Pharma Solutions Inc,Private,79-643-6181,Non Manufacturer,Subsidiary,1989,Headquarters,NEW JERSEY,325412,Pharmaceutical Preparation Manufacturing,,,,,28340000,Pharmaceutical preparations,"$2,651,821,173 ","8,300",377,"$1,938,488,598 "
"FEDEX GROUND PACKAGE SYSTEM, INC.",FedEx Ground Package System Inc,Private,11-913-3494,Manufacturer,Subsidiary,1984,Headquarters,PENNSYLVANIA,484121,"General Freight Trucking, Long-Distance, Truckload",484121,"""General Freight Trucking, Long-Distance, Truckload """,4213,"""Trucking, except local""",42139903,Contract haulers,"$2,507,775,530 ","10,000","3,000","$3,553,082,535 "
"BRIGHT HORIZONS FAMILY SOLUTIONS, INC.",Bright Horizons Family Solutions,Public,07-873-4723,Manufacturer,Non-Subsidiary,1986,Headquarters,MASSACHUSETTS,624410,Child Day Care Services,624410,"""Child Day Care Services """,8351,"""Child day care services""",83519905,Preschool center,"$2,062,017,000 ","31,200","1,000","$1,903,182,000 "
BOSTON UNIVERSITY,Boston University,Private,07-848-7802,Manufacturer,Non-Subsidiary,2012,Single Location,MASSACHUSETTS,611310,"Colleges, Universities, and Professional Schools",,,,,82210102,University,"$2,018,330,000 ",70,70,"$2,018,330,000 "
"CAPGEMINI NORTH AMERICA, INC.",Capgemini,Private,12-881-5607,Manufacturer,Subsidiary,2002,Headquarters,NEW YORK,541512,Computer Systems Design Services,541512,"""Computer Systems Design Services """,7379,"""Computer related services, nec""",73790203,Online services technology consultants,"$1,878,512,278 ","42,984",50,"$2,232,774,582 "
"NUANCE COMMUNICATIONS, INC.",Nuance Communications Inc,Public,79-740-7517,Manufacturer,Non-Subsidiary,1992,Headquarters,MASSACHUSETTS,511210,Software Publishers,511210,"""Software Publishers""",7372,"""Prepackaged software""",73729901,Application computer software,"$1,823,092,000 ","11,600",550,"$2,051,661,000 "
FIRST-CITIZENS BANK & TRUST COMPANY,First State Bank of Pinedale,Private,00-320-2975,Manufacturer,Subsidiary,1898,Headquarters,NORTH CAROLINA,522110,Commercial Banking,,,,,60220000,State commercial banks,"$1,784,792,000 ","4,821",250,"$1,741,456,000 "
FAIRWAY INDEPENDENT MORTGAGE CORPORATION,Fairway Independent Mortgage Corp,Private,96-051-8827,Manufacturer,Non-Subsidiary,1996,Headquarters,WISCONSIN,522292,Real Estate Credit,,,,,61629903,Mortgage bankers,"$1,772,255,217 ","3,400",100,"$35,378,275 "
BROWN BROTHERS HARRIMAN & CO.,Brown Brothers Harriman & Co,Private,00-698-1310,Manufacturer,Non-Subsidiary,1818,Headquarters,NEW YORK,523991,"Trust, Fiduciary, and Custody Activities","523110, 523991","""Investment Banking and Securities Dealing "", ""Trust, Fiduciary, and Custody Activities ""","6091, 6211","""Nondeposit trust facilities"", ""Security brokers and dealers""",60910000,Nondeposit trust facilities,"$1,578,848,773 ","3,000",950,"$1,653,036,409 "
HSBC FINANCE CORPORATION,HSBC Finance Corp,Public,05-555-7276,Manufacturer,Subsidiary,1878,Headquarters,ILLINOIS,522291,Consumer Lending,,,,,61410102,Consumer finance companies,"$1,414,000,000 ","1,600",36,"$1,414,000,000 "
FUJITSU AMERICA INC,Fujitsu America Inc,Private,01-843-1853,Manufacturer,Subsidiary,2000,Headquarters,CALIFORNIA,541512,Computer Systems Design Services,541512,"""Computer Systems Design Services """,7373,"""Computer integrated systems design""",73730000,Computer integrated systems design,"$1,378,505,511 ","6,225",400,"$1,693,760,685 "
EDUCATIONAL TESTING SERVICE INC,Educational Testing Service,Private,00-250-8463,Manufacturer,Non-Subsidiary,1947,Headquarters,NEW JERSEY,611710,Educational Support Services,"541720, 611710","""Research and Development in the Social Sciences and Humanities "", ""Educational Support Services""","8732, 8748","""Commercial nonphysical research"", ""Business consulting, nec""",87480102,"Testing service, educational or personnel","$1,358,021,141 ","2,756","2,157","$1,392,943,660 "
"CHART INDUSTRIES, INC.",Chart Industries Inc,Public,79-609-3458,Non Manufacturer,Non-Subsidiary,1992,Headquarters,GEORGIA,333415,Air-Conditioning and Warm Air Heating Equipment and Commercial and Industrial Refrigeration Equipment Manufacturing,"333249, 333415, 333999","""Other Industrial Machinery Manufacturing "", ""Air-Conditioning and Warm Air Heating Equipment and Commercial and Industrial Refrigeration Equipment Manufacturing "", ""All Other Miscellaneous General Purpose Machinery Manufacturing ""","3443, 3559, 3569","""Fabricated plate work (boiler shops)"", ""Special industry machinery, nec"", ""General industrial machinery, nec""",34430200,"Heat exchangers, condensers, and components","$1,299,100,000 ","4,605",26,"$1,084,300,000 "
"MONEYGRAM INTERNATIONAL, INC.",Money Gram International Inc,Public,14-579-1997,Manufacturer,Non-Subsidiary,1940,Headquarters,TEXAS,522320,"Financial Transactions Processing, Reserve, and Clearinghouse Activities",522320,"""Financial Transactions Processing, Reserve, and Clearinghouse Activities """,6099,"""Functions related to deposit banking""",60999903,"Electronic funds transfer network, including switching","$1,285,100,000 ","2,936",77,"$1,447,600,000 "
THE COMMERCE INSURANCE COMPANY,Commerce Insurance,Public,07-534-8359,Manufacturer,Subsidiary,1971,Headquarters,MASSACHUSETTS,524210,Insurance Agencies and Brokerages,,,,,64110000,"Insurance agents, brokers, and service","$1,240,281,690 ","1,495","1,205","$1,316,617,444 "
"PITT COUNTY MEMORIAL HOSPITAL, INCORPORATED",Pincipal Financial Group,Private,05-640-3462,Manufacturer,Subsidiary,1953,Headquarters,NORTH CAROLINA,622110,General Medical and Surgical Hospitals,622110,"""General Medical and Surgical Hospitals """,8062,"""General medical & surgical hospitals""",80629903,"Hospital, medical school affiliated with residency","$1,201,287,000 ","15,000","11,000","$1,201,287,000 "
"MERRILL LYNCH GROUP, INC.",Merrill Lynch,Private,60-650-0635,Manufacturer,Subsidiary,1987,Headquarters,NEW YORK,523930,Investment Advice,,,,,62829902,Investment advisory service,"$886,698,547 ","4,167",353,"$825,826,196 "
TRUSTEES OF BOSTON COLLEGE,TriNet HR Corp,Private,04-589-6339,Manufacturer,Non-Subsidiary,1863,Headquarters,MASSACHUSETTS,611310,"Colleges, Universities, and Professional Schools",611310,"""Colleges, Universities, and Professional Schools """,8221,"""Colleges and universities""",82210101,"College, except junior","$835,632,000 ","2,493",18,"$835,632,000 "
BLUE CROSS & BLUE SHIELD OF RHODE ISLAND,Blue Cross Blue Shield of RI,Private,07-312-8407,Manufacturer,Non-Subsidiary,1939,Headquarters,RHODE ISLAND,524114,Direct Health and Medical Insurance Carriers,524114,"""Direct Health and Medical Insurance Carriers """,6324,"""Hospital and medical service plans""",63249901,Dental insurance,"$754,060,996 ","1,100",146,"$329,711,457 "
FUTURE ELECTRONICS CORP.,Future Electronics Corp,Private,05-972-8071,Manufacturer,Subsidiary,1972,Headquarters,MASSACHUSETTS,423690,Other Electronic Parts and Equipment Merchant Wholesalers,,,,,50650300,Electronic parts,"$738,631,628 ","4,000","1,100","$587,667,208 "
MASSACHUSETTS FINANCIAL SERVICES COMPANY,Massachusetts Financial Services Company,Private,04-943-5415,Manufacturer,Subsidiary,1969,Headquarters,MASSACHUSETTS,523930,Investment Advice,"523930, 523999","""Investment Advice "", ""Miscellaneous Financial Investment Activities ""","6211, 6282, 6289","""Security brokers and dealers"", ""Investment advice"", ""Security & commodity services, nec""",62829902,Investment advisory service,"$716,534,973 ","1,700","1,200","$1,092,112,442 "
EASTERN BANK,Eastern Bank,Private,00-695-5009,Manufacturer,Subsidiary,1818,Headquarters,MASSACHUSETTS,522120,Savings Institutions,,,,,60369902,"State savings banks, not federally chartered","$595,479,000 ","1,358",217,"$534,707,000 "
"RADISSON HOTELS INTERNATIONAL, INC.",Radisson,Private,13-063-9305,Manufacturer,Subsidiary,1983,Headquarters,MINNESOTA,721110,Hotels (except Casino Hotels) and Motels,"237210, 531210, 533110, 541613, 561499, 721110","""Land Subdivision "", ""Offices of Real Estate Agents and Brokers"", ""Lessors of Nonfinancial Intangible Assets (except Copyrighted Works)"", ""Marketing Consulting Services "", ""All Other Business Support Services "", ""Hotels (except Casino Hotels) and Motels ""","6531, 6552, 6794, 7011, 7389, 8742","""Real estate agents and managers"", ""Subdividers and developers, nec"", ""Patent owners and lessors"", ""Hotels and motels"", ""Business services, nec"", ""Management consulting services""",70110300,Hotels,"$545,527,681 ","17,800",160,"$755,451,995 "
DELTA DENTAL OF NEW YORK INC.,Delta Dental of New York Inc,Private,07-863-6859,Manufacturer,Non-Subsidiary,1963,Single Location,PENNSYLVANIA,524114,Direct Health and Medical Insurance Carriers,,,,,63249901,Dental insurance,"$544,880,612 ",10,10,"$2,650,281 "
LEXISNEXIS RISK SOLUTIONS INC.,LexisNexis,Private,06-011-7244,Manufacturer,Subsidiary,1975,Headquarters,GEORGIA,541618,Other Management Consulting Services,,,,,87480000,"Business consulting, nec","$512,497,262 ","5,165","1,650","$537,551,853 "
"CAROMONT HEALTH, INC.",Caroll Enterprises Inc,Private,62-205-8519,Manufacturer,Non-Subsidiary,1984,Headquarters,NORTH CAROLINA,561110,Office Administrative Services,"561110, 621498, 622110","""Office Administrative Services"", ""All Other Outpatient Care Centers "", ""General Medical and Surgical Hospitals ""","8062, 8093, 8741","""General medical & surgical hospitals"", ""Specialty outpatient clinics, nec"", ""Management services""",87419907,Nursing and personal care facility management,"$510,637,401 ","2,400","1,900","$602,656,507 "
"EAGLE BANCORP, INC.",Eagle Bancorp Inc,Public,00-879-1217,Manufacturer,Non-Subsidiary,1997,Headquarters,MARYLAND,522110,Commercial Banking,522110,"""Commercial Banking """,6022,"""State commercial banks""",60229901,"State trust companies accepting deposits, commercial","$455,329,000 ",466,386,"$415,872,000 "
COLONIAL LIFE & ACCIDENT INSURANCE COMPANY INC,Colonial Life & Accident Insurance Co,Private,00-791-9376,Manufacturer,Subsidiary,1939,Headquarters,SOUTH CAROLINA,524113,Direct Life Insurance Carriers,524113,"""Direct Life Insurance Carriers ""","6311, 6321","""Life insurance"", ""Accident and health insurance""",63210101,Accident insurance carriers,"$443,380,311 ","1,300","1,200","$479,914,709 "
"NORTH SHORE MEDICAL CENTER, INC.",North Shore Medical Center,Private,62-065-5746,Manufacturer,Subsidiary,1985,Headquarters,MASSACHUSETTS,622110,General Medical and Surgical Hospitals,622110,"""General Medical and Surgical Hospitals """,8062,"""General medical & surgical hospitals""",80620000,General medical and surgical hospitals,"$416,036,580 ","5,000",23,"$407,191,421 "
"SEA RAY BOATS, INC.",Sea Ray Boats Inc,Private,06-108-7029,Non Manufacturer,Subsidiary,1972,Headquarters,TENNESSEE,336612,Boat Building,336612,"""Boat Building """,3732,"""Boat building and repairing""",37329902,"Boats, fiberglass: building and repairing","$331,872,047 ","1,782",800,"$331,872,047 "
"BLUE CROSS AND BLUE SHIELD OF MASSACHUSETTS, INC.",Blue Cross and Blue Shield of MA Inc,Private,05-781-5201,Manufacturer,Non-Subsidiary,1937,Headquarters,MASSACHUSETTS,524114,Direct Health and Medical Insurance Carriers,"524114, 561110","""Direct Health and Medical Insurance Carriers "", ""Office Administrative Services""","6321, 6324, 8741","""Accident and health insurance"", ""Hospital and medical service plans"", ""Management services""",63210102,Health insurance carriers,"$329,711,457 ","2,800","2,800","$329,711,457 "
EAST BOSTON SAVING BANK,East Boston Savings Bank,Private,01-975-9497,Manufacturer,Subsidiary,1848,Headquarters,MASSACHUSETTS,522110,Commercial Banking,,,,,60290000,"Commercial banks, nec","$278,042,000 ",401,63,"$199,235,000 "
"MFS INVESTMENT MANAGEMENT, LLC",MFS Investment Management,Private,95-836-2212,Manufacturer,Subsidiary,2019,Headquarters,MASSACHUSETTS,525910,Open-End Investment Funds,,,,,67229901,Money market mutual funds,"$245,251,237 ",722,163,"$235,445,579 "
"BOND BROTHERS, INC.",Bond Brothers,Private,00-799-8115,Manufacturer,Non-Subsidiary,1907,Headquarters,MASSACHUSETTS,236220,Commercial and Institutional Building Construction,,,,,15420101,"Commercial and office building, new construction","$242,628,872 ",350,100,"$242,628,872 "
SALEM FIVE CENTS SAVINGS BANK,Salem Five Cents Savings Bank,Private,00-695-5827,Manufacturer,Subsidiary,1855,Headquarters,MASSACHUSETTS,522110,Commercial Banking,,,,,60220000,State commercial banks,"$223,787,000 ",450,175,"$198,095,000 "
COLONIAL PENN LIFE INSURANCE COMPANY,Colonial Penn Life Insurance,Private,05-712-3671,Manufacturer,Subsidiary,1957,Single Location,PENNSYLVANIA,524114,Direct Health and Medical Insurance Carriers,,,,,63210102,Health insurance carriers,"$195,508,299 ",350,350,"$195,508,299 "
MIDDLESEX SAVINGS BANK,Middlesex Savings Bank,Private,00-695-5181,Manufacturer,Non-Subsidiary,1835,Headquarters,MASSACHUSETTS,522120,Savings Institutions,522120,"""Savings Institutions """,6036,"""Savings institutions, except federal""",60369902,"State savings banks, not federally chartered","$181,374,000 ",464,50,"$161,650,000 "
EISAI INC.,Eisai Inc,Private,18-924-6791,Non Manufacturer,Subsidiary,1995,Headquarters,NEW JERSEY,325412,Pharmaceutical Preparation Manufacturing,,,,,28340000,Pharmaceutical preparations,"$177,119,883 ",500,220,"$163,434,268 "
THE TRUSTEES OF MOUNT HOLYOKE COLLEGE,Mount Holyoke College,Private,06-698-5714,Manufacturer,Non-Subsidiary,1836,Headquarters,MASSACHUSETTS,611310,"Colleges, Universities, and Professional Schools",611310,"""Colleges, Universities, and Professional Schools """,8221,"""Colleges and universities""",82210101,"College, except junior","$151,471,000 ","1,000",37,"$142,585,000 "
"DAVIS VISION, INC.",Davis Vision Inc,Private,62-774-5276,Non Manufacturer,Subsidiary,1991,Headquarters,NEW YORK,339115,Ophthalmic Goods Manufacturing,339115,"""Ophthalmic Goods Manufacturing """,3851,"""Ophthalmic goods""",38510101,"Eyeglasses, lenses and frames","$150,908,045 ",3,3,"$186,306,229 "
LIFEWATCH CORP,LifeWatch Corp,Private,80-126-6201,Non Manufacturer,Subsidiary,2006,Headquarters,ILLINOIS,621999,All Other Miscellaneous Ambulatory Health Care Services,,,,,80990200,Physical examination and testing services,"$147,360,816 ",601,4,"$247,803,651 "
CITIZENS MEMORIAL HOSPITAL DISTRICT,Citizens Memorial Hospital,Private,13-958-3426,Manufacturer,Non-Subsidiary,1983,Single Location,MISSOURI,621111,Offices of Physicians (except Mental Health Specialists),,,,,80110500,"Specialized medical practitioners, except internal","$123,000,000 ",134,134,"$123,000,000 "
INSTITUTION FOR SAVINGS IN NEWBURYPORT AND ITS VICINITY CHAR,Institution for Savings,Private,78-556-8390,Manufacturer,Non-Subsidiary,1997,Headquarters,MASSACHUSETTS,522120,Savings Institutions,,,,,60369902,"State savings banks, not federally chartered","$117,825,000 ",59,4,"$103,379,000 "
"PARTNERS HOME CARE, INC.",Partners Home Care,Private,10-886-0842,Manufacturer,Non-Subsidiary,1901,Headquarters,MASSACHUSETTS,621610,Home Health Care Services,,,,,80829902,Visiting nurse service,"$107,526,825 ",185,21,"$98,294,603 "
