Company Name,clean_name,Company Type,D-U-N-S@ Number,Manufacturing Indicator,Subsidiary Status,Year of Founding,Location Type,Physical State,Primary NAICS Code,Primary NAICS Description,Secondary NAICS Code,Secondary NAICS Description,Secondary SIC Code,Secondary SIC Description,Primary SIC Code,Primary SIC Description,Sales,Employee All Sites,Employee this Site,Sales (Year 1)
"AMERIPATH, INC.",Ameripath,Public,03-244-9027,Manufacturer,Subsidiary,1996,Headquarters,FLORIDA,621511,Medical Laboratories,621511,"""Medical Laboratories """,8071,"""Medical laboratories""",80710104,Pathological laboratory,"$108,758,343 ","3,979",100,"$108,828,399 "
SPENCER SAVINGS BANK SLA,Sovereign Bank,Private,07-667-6345,Manufacturer,Non-Subsidiary,1939,Headquarters,NEW JERSEY,522120,Savings Institutions,,,,,60369901,"Savings and loan associations, not federally chartered","$106,096,000 ",200,57,"$95,095,000 "
EMPIRIX INC.,Empirix,Private,86-853-2131,Manufacturer,Non-Subsidiary,2000,Headquarters,MASSACHUSETTS,541511,Custom Computer Programming Services,"541380, 541511","""Testing Laboratories"", ""Custom Computer Programming Services ""","7371, 8734","""Computer programming services"", ""Testing laboratories""",73710301,Computer software development,"$100,364,560 ",380,129,"$86,665,319 "
BRISTOL COUNTY SAVINGS BANK INC,Bristoal Country Savings Bank,Private,01-976-1584,Manufacturer,Non-Subsidiary,1846,Headquarters,MASSACHUSETTS,522120,Savings Institutions,,,,,60360000,"Savings institutions, except federal","$99,428,000 ",163,40,"$87,190,000 "
"EASTER SEALS UCP NORTH CAROLINA & VIRGINIA, INC.",Easter Seals UCP NC & VA Inc,Private,04-003-8531,Manufacturer,Non-Subsidiary,1952,Headquarters,NORTH CAROLINA,624190,Other Individual and Family Services,,,,,83220610,Social service center,"$95,510,937 ","2,600",40,"$98,284,472 "
"TRAVELCLICK, INC.",TransUnion LLC,Private,13-536-0183,Manufacturer,Subsidiary,1987,Headquarters,NEW YORK,541511,Custom Computer Programming Services,541511,"""Custom Computer Programming Services """,7371,"""Computer programming services""",73710300,Computer software development and applications,"$92,885,098 ",815,200,"$91,288,026 "
"ELIOT COMMUNITY HUMAN SERVICES, INC.","Electrical Workers Deferred Income Fund Local 103, I.B.E.W",Private,07-952-5101,Manufacturer,Non-Subsidiary,1958,Headquarters,MASSACHUSETTS,623220,Residential Mental Health and Substance Abuse Facilities,,,,,83610302,Mentally handicapped home,"$92,867,350 ","2,000",40,"$92,867,350 "
THE CHRISTIAN AND MISSIONARY ALLIANCE FOUNDATION INC,The Children's Hospital League,Private,04-817-5442,Manufacturer,Non-Subsidiary,1967,Headquarters,FLORIDA,531110,Lessors of Residential Buildings and Dwellings,,,,,65139903,Retirement hotel operation,"$92,701,282 ",750,550,"$103,001,424 "
UNIVERSITY OF MASSACHUSETTS DARTMOUTH,University of Massachusetts - Dartmouth,Private,06-392-1985,Manufacturer,Non-Subsidiary,0,Single Location,MASSACHUSETTS,611310,"Colleges, Universities, and Professional Schools",,,,,82210102,University,"$91,400,000 ",800,800,"$91,400,000 "
"CENTER FOR HUMAN DEVELOPMENT, INCORPORATED",,Private,09-919-5695,Manufacturer,Non-Subsidiary,1972,Headquarters,MASSACHUSETTS,624190,Other Individual and Family Services,,,,,83220610,Social service center,"$87,666,596 ","1,100",60,"$87,666,596 "
"FAMOUS DAVE'S OF AMERICA, INC.",Famous Dave's of America Inc,Public,93-260-6262,Manufacturer,Subsidiary,1995,Headquarters,MINNESOTA,722511,Full-Service Restaurants,"533110, 722511","""Lessors of Nonfinancial Intangible Assets (except Copyrighted Works)"", ""Full-Service Restaurants ""","5812, 6794","""Eating places"", ""Patent owners and lessors""",58120500,Family restaurants,"$82,269,000 ",779,74,"$64,595,000 "
VIRGINIA AIR DISTRIBUTORS INC,Virginia Air Distributors Inc,Private,15-449-8513,Manufacturer,Non-Subsidiary,1987,Headquarters,VIRGINIA,423620,"Household Appliances, Electric Housewares, and Consumer Electronics Merchant Wholesalers",,,,,50649902,"Appliance parts, household","$64,644,031 ",160,36,"$64,644,031 "
"WAMU INVESTMENTS, INC.",Walsh Pharmacy,Private,06-754-8503,Manufacturer,Subsidiary,1888,Headquarters,WASHINGTON,523120,Securities Brokerage,,,,,62110204,"Investment firm, general brokerage","$64,598,648 ",119,33,"$4,611,384 "
"CONCUR TECHNOLOGIES, INC.",Concur Technologies Inc,Public,86-726-2263,Manufacturer,Subsidiary,1994,Headquarters,WASHINGTON,541511,Custom Computer Programming Services,"511210, 541511","""Software Publishers"", ""Custom Computer Programming Services ""","7371, 7372","""Computer programming services"", ""Prepackaged software""",73710100,Custom computer programming services,"$63,823,602 ","3,765","1,488","$1,020,621,133 "
BROADSPIRE SERVICES INC,Broadspire Legal,Private,14-410-0757,Manufacturer,Subsidiary,1979,Headquarters,FLORIDA,621999,All Other Miscellaneous Ambulatory Health Care Services,,,,,80999905,Medical services organization,"$63,813,956 ","2,150","1,300","$70,904,396 "
DEDHAM INSTITUTION FOR SAVINGS,Dedham Institution for Savings,Private,00-695-4093,Manufacturer,Non-Subsidiary,1831,Headquarters,MASSACHUSETTS,522120,Savings Institutions,,,,,60369902,"State savings banks, not federally chartered","$59,430,000 ",169,125,"$53,851,000 "
EASTHAMPTON SAVINGS BANK,Easthampton Savings Bank,Private,00-695-4135,Manufacturer,Non-Subsidiary,1869,Headquarters,MASSACHUSETTS,522120,Savings Institutions,,,,,60359902,Federal savings banks,"$55,683,000 ",127,42,"$53,329,000 "
"DAEDALUS BOOKS, INC.",Daedalus Books Inc,Private,06-927-7853,Manufacturer,Non-Subsidiary,1980,Single Location,OHIO,424920,"Book, Periodical, and Newspaper Merchant Wholesalers",,,,,51929901,Books,"$55,586,318 ",170,170,$0 
UNIFORMED SERVICES BENEFIT ASSOCIATION,Uniformed Services Benefit Association,Private,07-307-1334,Manufacturer,Non-Subsidiary,0,Single Location,MISSOURI,524298,All Other Insurance Related Activities,,,,,64110101,"Advisory services, insurance","$54,271,095 ",65,0,"$54,271,095 "
ARCHSTONE NEW DEVELOPMENT HOLDINGS LP,Archstone,Private,96-849-9017,Manufacturer,Non-Subsidiary,2007,Headquarters,VIRGINIA,551112,Offices of Other Holding Companies,,,,,67199902,"Personal holding companies, except banks","$42,842,029 ",500,75,"$42,842,029 "
BUENA VISTA UNIVERSITY,Buena Vista University,Private,07-697-8972,Manufacturer,Non-Subsidiary,1891,Headquarters,IOWA,611310,"Colleges, Universities, and Professional Schools",,,,,82210102,University,"$42,598,547 ",350,210,"$51,456,179 "
WEBSTER FIVE CENTS SAVINGS BANK,Webster Five Cents Savings Bank,Private,00-695-6486,Manufacturer,Non-Subsidiary,1868,Headquarters,MASSACHUSETTS,522120,Savings Institutions,,,,,60369902,"State savings banks, not federally chartered","$36,992,000 ",175,55,"$34,252,000 "
"TELHIO CREDIT UNION, INC.",TeleTech Holding,Private,09-216-0548,Manufacturer,Non-Subsidiary,1935,Headquarters,OHIO,522130,Credit Unions,,,,,60610000,Federal credit unions,"$32,802,511 ",83,50,"$30,830,602 "
BANKFIVE CORPORATION,Bank of Vernon,Private,83-047-1467,Manufacturer,Non-Subsidiary,2005,Headquarters,MASSACHUSETTS,522120,Savings Institutions,,,,,60369902,"State savings banks, not federally chartered","$32,440,000 ",12,12,"$32,440,000 "
SHREWSBURY PUBLIC SCHOOLS,Shrewsbury Public Schools,Private,07-979-9393,Manufacturer,Non-Subsidiary,2015,Headquarters,MASSACHUSETTS,611110,Elementary and Secondary Schools,,,,,82110300,Public elementary and secondary schools,"$31,760,721 ",816,30,"$28,873,383 "
VERSO PAPER CORP,Verso Paper Corp,Private,96-809-9569,Non Manufacturer,Non-Subsidiary,0,Single Location,MAINE,322121,Paper (except Newsprint) Mills,,,,,26210000,Paper mills,"$29,605,582 ",99,99,"$14,100,000 "
"EMPIRE EQUITY GROUP, INC.",Empire Equity,Private,13-179-6500,Manufacturer,Non-Subsidiary,0,Single Location,NORTH CAROLINA,531210,Offices of Real Estate Agents and Brokers,,,,,65310100,Real estate brokers and agents,"$28,014,514 ","1,250",50,"$37,400,000 "
ST MARYS CREDIT UNION INC,St Mary's Credit Union,Private,08-002-7634,Manufacturer,Non-Subsidiary,1913,Headquarters,MASSACHUSETTS,522130,Credit Unions,,,,,60610000,Federal credit unions,"$27,546,800 ",150,60,"$25,151,075 "
"CAROLINA WEST WIRELESS, INC.",Carolina West Wireless Inc,Private,62-466-5899,Manufacturer,Non-Subsidiary,1989,Headquarters,NORTH CAROLINA,517312,Wireless Telecommunications Carriers (except Satellite),,,,,48129901,Cellular telephone services,"$25,035,474 ",60,52,"$23,413,322 "
"CENTRIC SOFTWARE, INC.",Centric Software Inc,Private,60-577-7085,Manufacturer,Non-Subsidiary,1989,Headquarters,CALIFORNIA,541611,Administrative Management and General Management Consulting Services,,,,,87420000,Management consulting services,"$22,779,176 ",98,42,"$18,825,765 "
"CORCORAN MANAGEMENT COMPANY, INC.","Coral Springs, FL (City of)",Private,07-170-4134,Manufacturer,Non-Subsidiary,1979,Headquarters,MASSACHUSETTS,531110,Lessors of Residential Buildings and Dwellings,,,,,65130000,Apartment building operators,"$20,014,117 ",300,30,"$15,036,903 "
COOPER UNIVERSITY HEALTH CARE,Cooper University Health Care,Private,07-963-8717,Manufacturer,Non-Subsidiary,2014,Headquarters,NEW JERSEY,622110,General Medical and Surgical Hospitals,,,,,80620000,General medical and surgical hospitals,"$18,368,252 ",307,19,"$15,180,374 "
CALDWELL COMMUNITY COLLEGE & TECHNICAL INSTITUTE,Caldwell Community College and Technical Institute,Private,07-905-4045,Manufacturer,Subsidiary,1964,Headquarters,NORTH CAROLINA,611210,Junior Colleges,,,,,82229901,Community college,"$17,769,269 ",600,363,"$17,769,269 "
THE AMERICAN INSTITUTE FOR CANCER RESEARCH INC,American Institute for Cancer Research,Private,10-191-8860,Manufacturer,Non-Subsidiary,1981,Single Location,VIRGINIA,813319,Other Social Advocacy Organizations,,,,,83999904,"Fund raising organization, non-fee basis","$15,551,676 ",70,70,"$15,551,676 "
BLUE RIDGE BONE AND JOINT CLINIC PA,Blue Cross Blue Shield of Georgia,Private,07-904-8898,Manufacturer,Non-Subsidiary,1974,Headquarters,NORTH CAROLINA,621111,Offices of Physicians (except Mental Health Specialists),,,,,80110514,Orthopedic physician,"$13,410,115 ",132,69,"$13,410,115 "
SC DHEC,,Private,01-529-3364,Manufacturer,Non-Subsidiary,2010,Single Location,SOUTH CAROLINA,562910,Remediation Services,,,,,49590302,Environmental cleanup services,"$11,644,831 ",69,69,"$11,644,831 "
SHOWA BOSTON INSTITUTE FOR LANGUAGE AND CULTURE INC,,Private,18-377-4231,Manufacturer,Non-Subsidiary,1987,Single Location,MASSACHUSETTS,611310,"Colleges, Universities, and Professional Schools",,,,,82210102,University,"$11,620,186 ",53,53,"$11,620,186 "
APOLLO SECURITY INC,Aon Corp,Private,16-252-9155,Manufacturer,Non-Subsidiary,2001,Single Location,NEW YORK,561612,Security Guards and Patrol Services,,,,,73810100,Guard services,"$10,000,000 ",300,300,"$10,000,000 "
"CORELOGIC CREDCO, LLC",CoreLogic Credco LLC,Public,01-019-9297,Manufacturer,Subsidiary,2005,Headquarters,CALIFORNIA,561450,Credit Bureaus,,,,,73239902,Consumer credit reporting bureau,"$9,404,727 ",500,220,"$9,404,727 "
"DESTINATION HOTELS AND RESORTS, INC",Destination Hotels & Resorts Inc,Private,87-803-7779,Manufacturer,Non-Subsidiary,0,Branch,WASHINGTON,721199,All Other Traveler Accommodation,,,,,70110200,Vacation lodges,"$9,100,000 ",0,250,$0 
WAKEFIELD COOPERATIVE BANK,Wakefield Coopertive Bank,Private,06-126-5922,Manufacturer,Non-Subsidiary,1887,Headquarters,MASSACHUSETTS,522120,Savings Institutions,,,,,60359901,Federal savings and loan associations,"$8,695,000 ",45,45,"$7,721,000 "
BENEFIT CONCEPTS INC OF RHODE ISLAND,Benefit Concepts Inc,Private,13-576-4058,Manufacturer,Subsidiary,1985,Headquarters,NEW YORK,541612,Human Resources Consulting Services,,,,,87420201,Compensation and benefits planning consultant,"$8,554,852 ",225,200,"$9,505,391 "
EASTERN RADIOLOGISTS INC,Eastern Radiologists Inc,Private,08-236-6311,Manufacturer,Non-Subsidiary,1952,Headquarters,NORTH CAROLINA,621111,Offices of Physicians (except Mental Health Specialists),,,,,80110519,Radiologist,"$8,370,743 ",60,50,"$8,370,743 "
CHARLES RIVER MEDICAL ASSOCIATES PC,"Charles River Medical Associates, P.C.",Private,11-071-6222,Manufacturer,Non-Subsidiary,1995,Headquarters,MASSACHUSETTS,621111,Offices of Physicians (except Mental Health Specialists),,,,,80110105,"Internal medicine, physician/surgeon","$7,943,817 ",35,5,"$7,943,817 "
AMERITAS INVESTMENT CORP,Amerita's Investment Corp,Private,11-507-2977,Manufacturer,Subsidiary,1983,Headquarters,NEBRASKA,523120,Securities Brokerage,,,,,62110106,Stock brokers and dealers,"$7,500,000 ",135,30,"$7,500,000 "
EDUCATIONAL THEATRE ASSOCIATION,Educational Theatre Association,Private,07-678-9585,Manufacturer,Non-Subsidiary,1929,Headquarters,OHIO,813410,Civic and Social Organizations,,,,,86990200,Reading rooms and other cultural organizations,"$7,279,126 ",30,30,$0 
"GOODWILL INDUSTRIES OF THE PIONEER VALLEY, INC.",Goodwill Industries of the Pioneer Valley Inc,Private,06-697-6085,Manufacturer,Non-Subsidiary,1925,Headquarters,MASSACHUSETTS,453310,Used Merchandise Stores,,,,,59320401,"Clothing, secondhand","$7,209,689 ",625,350,"$7,209,689 "
AMERICAN FEDERATION OF TELEVISION & RADIO ARTISTS,American Federation of Television & Radio Artists (AFTRA),Private,07-773-8318,Manufacturer,Non-Subsidiary,1937,Headquarters,NEW YORK,813930,Labor Unions and Similar Labor Organizations,,,,,86319903,Labor union,"$6,612,198 ",56,16,"$6,612,198 "
UNIVERSITY OF MASSACHUSETTS AMHERST,University Hospital,Private,07-875-1735,Manufacturer,Subsidiary,2013,Headquarters,MASSACHUSETTS,611310,"Colleges, Universities, and Professional Schools",,,,,82210102,University,"$6,158,635 ",43,38,"$6,158,635 "
COLLECTION TECHNOLOGY INC,Collection Technology Inc,Private,13-933-5269,Manufacturer,Non-Subsidiary,1953,Single Location,CALIFORNIA,561440,Collection Agencies,,,,,73229902,"Collection agency, except real estate","$5,984,136 ",100,100,"$5,984,136 "
"FIRST ADVANTAGE TAX CONSULTING SERVICES, LLC",First AdVantage Tax Consulting Services LLC,Private,05-498-5106,Manufacturer,Subsidiary,1981,Single Location,INDIANA,541611,Administrative Management and General Management Consulting Services,,,,,87420000,Management consulting services,"$5,930,379 ",60,60,"$5,930,379 "
"EHRENKRANTZ ECKSTUT & KUHN ARCHITECTS, P.C.",Ehrenkrantz Eckstut & Kuhn Architects Inc,Private,06-824-1017,Manufacturer,Non-Subsidiary,1972,Headquarters,NEW YORK,541310,Architectural Services,,,,,87120101,Architectural engineering,"$5,582,656 ",70,24,"$5,582,656 "
STONEHAM BANK,Stoneham Bank,Private,60-655-9573,Manufacturer,Non-Subsidiary,1988,Single Location,MASSACHUSETTS,541611,Administrative Management and General Management Consulting Services,,,,,87420401,Banking and finance consultant,"$5,000,000 ",14,14,"$5,000,000 "
AMERICAN STUDENT ASSISTANCE SERVICES CORPORATION,American Student Assistance,Private,78-619-1171,Manufacturer,Non-Subsidiary,0,Single Location,MASSACHUSETTS,522291,Consumer Lending,,,,,61410000,Personal credit institutions,"$4,900,000 ",40,40,"$4,900,000 "
HAMPTON INN TROPICANA,Hampton Inn Tropicana,Private,09-484-7766,Manufacturer,Non-Subsidiary,1999,Single Location,NEVADA,721110,Hotels (except Casino Hotels) and Motels,,,,,70110000,Hotels and motels,"$4,793,848 ",94,94,"$5,326,498 "
BRANCH BANKING AND TRUST COMPANY,Bowdoin College,Private,80-044-2050,Manufacturer,Non-Subsidiary,0,Branch,NEW YORK,522110,Commercial Banking,,,,,60220000,State commercial banks,"$3,800,000 ",0,30,"$40,000 "
DARE COUNTY ABC BOARD,Dare County ABC #4,Private,10-173-9480,Manufacturer,Non-Subsidiary,1950,Headquarters,NORTH CAROLINA,445310,"Beer, Wine, and Liquor Stores",,,,,59210000,Liquor stores,"$3,456,370 ",32,23,"$3,456,370 "
BEIJING CENTER FOR CHINESE STUDIESINC,Beijing Center,Private,01-437-1810,Manufacturer,Non-Subsidiary,2010,Single Location,ILLINOIS,722511,Full-Service Restaurants,,,,,58120103,Chinese restaurant,"$3,226,167 ",0,0,"$3,226,167 "
ALL AMERICAN HOME MORTGAGE CO INC,American Home Mortgage Inc,Private,96-037-2217,Manufacturer,Non-Subsidiary,1996,Headquarters,CONNECTICUT,522390,Other Activities Related to Credit Intermediation,,,,,61620000,Mortgage bankers and loan correspondents,"$2,392,000 ",14,11,"$2,392,000 "
"AVMED, INC.",AvMed Inc,Private,02-054-3633,Manufacturer,Subsidiary,1986,Headquarters,FLORIDA,524114,Direct Health and Medical Insurance Carriers,524114,"""Direct Health and Medical Insurance Carriers """,6324,"""Hospital and medical service plans""",63249903,"Health Maintenance Organization (HMO), insurance only","$2,198,531 ",829,396,"$1,035,029,269 "
E BROOKS WILKINS FAMILY MEDICINE PA,E. Brooks Wilkins Family Medicine PA,Private,13-878-0437,Manufacturer,Non-Subsidiary,2002,Single Location,NORTH CAROLINA,621111,Offices of Physicians (except Mental Health Specialists),,,,,80119901,"General and family practice, physician/surgeon","$2,150,779 ",15,15,"$2,150,779 "
"EMERGENCY HEALTHCARE PHYSICIANS, LTD.",Elliot Health System,Private,36-099-1900,Manufacturer,Non-Subsidiary,2005,Single Location,ILLINOIS,621111,Offices of Physicians (except Mental Health Specialists),,,,,80119901,"General and family practice, physician/surgeon","$1,936,539 ",28,28,"$2,390,789 "
CINCINNATI CHILDRENS HOSPITAL,Cincinnati Children's Hospital,Private,08-070-9482,Manufacturer,Non-Subsidiary,2017,Single Location,OHIO,621999,All Other Miscellaneous Ambulatory Health Care Services,,,,,80999905,Medical services organization,"$1,877,908 ",24,24,"$1,864,641 "
ECS LEARNING SYSTEMS INC.,ECS Learning Systems Inc,Private,14-560-6443,Non Manufacturer,Non-Subsidiary,0,Single Location,TEXAS,511130,Book Publishers,,,,,27310000,Book publishing,"$1,818,581 ",34,14,"$1,162,441 "
CHASE INVESTMENT SERVICES CORP.,"Chase Bank USA, N.A.",Private,78-706-7029,Manufacturer,Subsidiary,1989,Headquarters,ILLINOIS,523930,Investment Advice,,,,,62820000,Investment advice,"$1,790,250 ",9,7,"$1,790,250 "
"BAYNORTH CAPITAL, LLC",Baylor Health Care Systems,Private,15-296-8074,Manufacturer,Non-Subsidiary,2004,Single Location,MASSACHUSETTS,531110,Lessors of Residential Buildings and Dwellings,,,,,67980000,Real estate investment trusts,"$1,691,193 ",15,15,"$1,691,193 "
DAVID FRENCH MUSIC CO INC,David French Music Co,Private,17-573-6537,Manufacturer,Non-Subsidiary,1987,Single Location,MASSACHUSETTS,532289,All Other Consumer Goods Rental,,,,,73590900,Musical instrument rental services,"$1,400,000 ",11,11,"$1,400,000 "
WAKE COUNTY PUBLIC SCHOOL,Wake County Public Schools,Private,02-123-3816,Manufacturer,Non-Subsidiary,2012,Single Location,NORTH CAROLINA,611110,Elementary and Secondary Schools,,,,,82110000,Elementary and secondary schools,"$1,341,638 ",19,19,"$1,341,638 "
ALBEMARLE PEDIATRICS,Albemarle Pediatrics,Private,06-981-0960,Manufacturer,Non-Subsidiary,1988,Single Location,NORTH CAROLINA,621111,Offices of Physicians (except Mental Health Specialists),,,,,80110516,Pediatrician,"$1,274,705 ",14,14,"$1,274,705 "
SPRINGFIELD TECHNICAL COMMUNITY COLLEGE,Springfield Technical Community College,Private,06-698-3636,Manufacturer,Non-Subsidiary,2003,Single Location,MASSACHUSETTS,611210,Junior Colleges,,,,,82229901,Community college,"$1,238,975 ",2,2,"$1,238,975 "
"BUILDING MEDIA, INC.",Building Media Inc,Private,80-330-9827,Manufacturer,Subsidiary,2002,Single Location,IDAHO,611699,All Other Miscellaneous Schools and Instruction,,,,,82990200,Educational services,"$1,180,645 ",6,6,"$1,311,828 "
"EARTHLINK HOLDINGS, LLC",EarthLink LLC,Private,11-699-3892,Manufacturer,Non-Subsidiary,2018,Headquarters,GEORGIA,517311,Wired Telecommunications Carriers,,,,,48130201,Internet connectivity services,"$1,162,676 ",60,3,"$1,162,676 "
CALEB FOUNDATION INC,Caleb Foundation,Private,92-704-6359,Manufacturer,Non-Subsidiary,1992,Headquarters,MASSACHUSETTS,531110,Lessors of Residential Buildings and Dwellings,,,,,65130000,Apartment building operators,"$1,054,679 ",10,5,"$1,054,679 "
FRAMES BY MAIL,Frames By Mail,Private,04-174-9586,Manufacturer,Non-Subsidiary,1986,Single Location,MISSOURI,453998,All Other Miscellaneous Store Retailers (except Tobacco Stores),,,,,59991606,"Picture frames, ready made","$728,715 ",20,20,"$728,715 "
SUPERIOR SCHOOL OF REAL ESTATE INC,Superior School of Real Estate,Private,60-630-8794,Manufacturer,Non-Subsidiary,2005,Single Location,NORTH CAROLINA,611519,Other Technical and Trade Schools,,,,,82490202,Real estate and insurance school,"$525,325 ",6,6,"$525,325 "
CONSTELLATION WINES U S INC,Constellation Wines US,Private,93-813-3043,Manufacturer,Non-Subsidiary,0,Single Location,CALIFORNIA,424820,Wine and Distilled Alcoholic Beverage Merchant Wholesalers,,,,,51820100,Wine,"$370,000 ",3,3,$0 
EASTMORELAND SURGICAL CLINIC VEIN CENTER,"Eastern Sales & Marketing, New England",Private,10-942-0570,Manufacturer,Non-Subsidiary,1970,Single Location,OREGON,621111,Offices of Physicians (except Mental Health Specialists),,,,,80119905,Surgeon,"$360,000 ",5,5,"$360,000 "
APPLIED BEHAVIORAL ASSOCIATES,Applied Behavioral Associates LLC,Private,84-861-1547,Manufacturer,Non-Subsidiary,1987,Headquarters,MASSACHUSETTS,621330,Offices of Mental Health Practitioners (except Physicians),,,,,80490401,Clinical psychologist,"$338,707 ",4,4,"$338,707 "
VERNON SALES PROMOTION,Vernon Sales Promotion,Private,04-376-0623,Manufacturer,Non-Subsidiary,2001,Single Location,GEORGIA,541810,Advertising Agencies,,,,,73119901,Advertising consultant,"$330,000 ",4,4,"$450,000 "
THE KOLBURNE SCHOOL INC,The Kolburne School Inc,Private,06-052-2562,Manufacturer,Non-Subsidiary,1947,Single Location,MASSACHUSETTS,623990,Other Residential Care Facilities,,,,,83610100,Residential care for children,"$306,261 ",2,2,"$306,261 "
"PATHAK MD, ANU",Partnership for Excellence in Jewish Education,Private,84-007-9672,Manufacturer,Non-Subsidiary,0,Single Location,MASSACHUSETTS,621111,Offices of Physicians (except Mental Health Specialists),,,,,80110516,Pediatrician,"$290,000 ",4,4,"$290,000 "
BEER & WINE HOBBY 2 INC,Beer & Wine Hobby Baccus Inc,Private,03-607-5348,Manufacturer,Non-Subsidiary,2011,Single Location,MASSACHUSETTS,424820,Wine and Distilled Alcoholic Beverage Merchant Wholesalers,,,,,51820100,Wine,"$259,138 ",3,3,"$259,138 "
FEDCOMP INC,FedComp Inc,Private,03-270-4533,Manufacturer,Non-Subsidiary,0,Single Location,NEW JERSEY,511210,Software Publishers,,,,,73720000,Prepackaged software,"$220,000 ",2,2,"$220,000 "
"HANGER ORTHOPEDIC GROUP, INC.",Hanger Orthopedic Group Inc,Private,07-749-4958,Non Manufacturer,Non-Subsidiary,2009,Single Location,GEORGIA,315110,Hosiery and Sock Mills,,,,,22510000,"Women's hosiery, except socks","$212,258 ",1,1,"$212,258 "
FRONTIER INSURANCE GROUP,Frontier Insurance Group LLC,Private,02-571-0604,Manufacturer,Non-Subsidiary,0,Single Location,VIRGINIA,524210,Insurance Agencies and Brokerages,,,,,64110000,"Insurance agents, brokers, and service","$210,000 ",3,3,"$210,000 "
UNC SCHOOL OF THE ARTS,UNC School of Arts,Private,06-133-0461,Manufacturer,Non-Subsidiary,2014,Single Location,NORTH CAROLINA,611110,Elementary and Secondary Schools,,,,,82110000,Elementary and secondary schools,"$205,084 ",10,10,"$205,084 "
THE ERICKSON INSTITUTE,Erickson Institute,Private,07-358-1600,Manufacturer,Non-Subsidiary,0,Single Location,CALIFORNIA,541720,Research and Development in the Social Sciences and Humanities,,,,,87330000,Noncommercial research organizations,"$190,000 ",3,3,"$190,000 "
"ENOS HOME OXYGEN & MEDICAL SUPPLY, INC.",Employment Security Commission of NC,Private,02-173-4035,Manufacturer,Non-Subsidiary,2008,Single Location,MASSACHUSETTS,423450,"Medical, Dental, and Hospital Equipment and Supplies Merchant Wholesalers",,,,,50470300,Medical equipment and supplies,"$172,326 ",2,2,"$149,970 "
"DRUGSTORE.COM, INC.",drugstore.com,Public,01-193-8037,Manufacturer,Subsidiary,1998,Headquarters,WASHINGTON,454110,Electronic Shopping and Mail-Order Houses,454110,"""Electronic Shopping and Mail-Order Houses """,5961,"""Catalog and mail-order houses""",59619924,"Pharmaceuticals, mail order","$146,000 ",945,300,"$146,000 "
CHOWAN HOSPITAL,Chowan Hospital,Private,06-923-3392,Manufacturer,Non-Subsidiary,0,Single Location,NORTH CAROLINA,621111,Offices of Physicians (except Mental Health Specialists),,,,,80110107,Neurologist,"$140,000 ",3,3,"$140,000 "
CARIDIANBCT,Caridian BCT,Private,83-725-6614,Manufacturer,Non-Subsidiary,2009,Single Location,COLORADO,423450,"Medical, Dental, and Hospital Equipment and Supplies Merchant Wholesalers",,,,,50470000,Medical and hospital equipment,"$135,881 ",2,2,"$127,994 "
ADVANCE PIERRE FOODS,Advance Pierre Foods,Private,05-217-6723,Manufacturer,Non-Subsidiary,2014,Single Location,ARKANSAS,999990,,,,,,99992222,"Duns Support Record, nonclassifiable establishment","$101,518 ",3,3,"$101,518 "
TYCO FLOW CONTROL AMERICAS,Tyco Flow Control Americas,Private,04-554-3259,Manufacturer,Non-Subsidiary,2012,Single Location,NEW JERSEY,561621,Security Systems Services (except Locksmiths),,,,,73820000,Security systems services,"$95,622 ",2,2,"$95,622 "
CAROLINA CENTER FOR DEVELOPMENT AND REHABILITATION,Carolina Center for Development and Rehabilitation,Private,04-247-0844,Manufacturer,Non-Subsidiary,1997,Single Location,NORTH CAROLINA,622110,General Medical and Surgical Hospitals,,,,,80620000,General medical and surgical hospitals,"$75,832 ",3,3,"$75,832 "
BIND BIOSCIENCES INC.,Bind Biosciences,Private,11-297-8610,Non Manufacturer,Non-Subsidiary,2019,Single Location,MASSACHUSETTS,325412,Pharmaceutical Preparation Manufacturing,,,,,28340000,Pharmaceutical preparations,"$74,425 ",2,2,$0 
BAY STATE CHILD CARE FOOD PROGRAM INC,Bay State Child Care Food Program Inc,Private,09-227-0466,Manufacturer,Non-Subsidiary,0,Single Location,MASSACHUSETTS,624410,Child Day Care Services,,,,,83510000,Child day care services,"$42,000 ",1,1,"$42,000 "
DSM DYNEEMA LLC,DSM Dyneema LLC,Private,96-999-8918,Non Manufacturer,Non-Subsidiary,0,Branch,NORTH CAROLINA,325220,Artificial and Synthetic Fibers and Filaments Manufacturing,,,,,28240000,"Organic fibers, noncellulosic",$0 ,0,9,$0 
