Company Name,clean_name,Company Type,D-U-N-S@ Number,Manufacturing Indicator,Subsidiary Status,Year of Founding,Location Type,Physical State,Primary NAICS Code,Primary NAICS Description,Secondary NAICS Code,Secondary NAICS Description,Secondary SIC Code,Secondary SIC Description,Primary SIC Code,Primary SIC Description,Sales,Employee All Sites,Employee this Site,Sales (Year 1)
JM SMUCKER CO,JM Smucker Co,Private,92-728-6323,Manufacturer,Non-Subsidiary,2012,Single Location,ILLINOIS,424410,General Line Grocery Merchant Wholesalers,,,,,51410000,"Groceries, general line","$140,000 ",2,2,$0 
PEACHTREE NATURAL FOODS,Peachtree Natural Foods,Private,01-309-9754,Manufacturer,Non-Subsidiary,0,Single Location,GEORGIA,446191,Food (Health) Supplement Stores,,,,,54990102,Health foods,"$140,000 ",3,3,"$140,000 "
JONES LANG LA SALLE AMERICAS INC,Jones Lang La Salle Americas Inc,Private,07-689-4780,Manufacturer,Non-Subsidiary,2015,Single Location,CALIFORNIA,531120,Lessors of Nonresidential Buildings (except Miniwarehouses),,,,,65120100,Commercial and industrial building operation,"$136,483 ",2,2,"$136,483 "
LAW OFFICES OF MARK E SALOMONE,Latsar Inc,Private,96-971-3820,Manufacturer,Non-Subsidiary,2009,Single Location,MASSACHUSETTS,541110,Offices of Lawyers,,,,,81110000,Legal services,"$130,000 ",2,2,"$130,000 "
MORGAN KEEGAN & COMPANY INC,Morgan Keegan & Company Inc,Private,02-692-3977,Manufacturer,Non-Subsidiary,0,Single Location,TEXAS,523120,Securities Brokerage,,,,,62110106,Stock brokers and dealers,"$130,000 ",2,2,"$120,000 "
JOSEPH M SMITH COMMUNITY HEALTH CENTER,Joseph M Smith Community Health Center,Private,87-941-7926,Manufacturer,Non-Subsidiary,2007,Single Location,MASSACHUSETTS,621399,Offices of All Other Miscellaneous Health Practitioners,,,,,80490000,Offices of health practitioner,"$110,000 ",2,2,"$110,000 "
RESNICK INVESTMENT ADVISORS,Resnick Investment Advisors Inc,Private,06-574-5629,Manufacturer,Non-Subsidiary,2013,Single Location,NORTH CAROLINA,523910,Miscellaneous Intermediation,,,,,67990000,"Investors, nec","$100,000 ",2,2,"$100,000 "
TRINET HR CORP,TriNet HR Corp,Private,08-863-7077,Manufacturer,Non-Subsidiary,2015,Single Location,MISSOURI,999990,,,,,,99992222,"Duns Support Record, nonclassifiable establishment","$94,459 ",7,7,"$94,459 "
UNIVERSITY HEALTH CARE SYSTEM DSL,University Health Care System,Private,06-256-7745,Manufacturer,Non-Subsidiary,2012,Single Location,GEORGIA,622110,General Medical and Surgical Hospitals,,,,,80620000,General medical and surgical hospitals,"$51,522 ",1,1,"$46,838 "
INSOURCE CONTRACT SERVICES,Insource Contract Services LLC,Private,94-168-3208,Manufacturer,Non-Subsidiary,2007,Single Location,NORTH CAROLINA,541990,"All Other Professional, Scientific, and Technical Services",,,,,89990000,"Services, nec","$44,000 ",1,1,"$44,000 "
THOMSON COMPUMARK,Thomson CompuMark,Private,11-708-3203,Manufacturer,Non-Subsidiary,2005,Single Location,MASSACHUSETTS,541611,Administrative Management and General Management Consulting Services,,,,,87429902,Business management consultant,"$34,669 ",1,1,"$34,669 "
GENERAL COUNCIL ON FINANCE AND ADMINISTRATION OF THE UNITED METHODIST CHURCH,General Council of Finance and Administration of United Methodist Church,Private,04-698-8127,Manufacturer,Non-Subsidiary,0,Single Location,PENNSYLVANIA,813110,Religious Organizations,,,,,86610000,Religious organizations,$0 ,0,25,$0 
"NX AERO, LLC",NX AERO LLC,Private,04-648-2827,Manufacturer,Non-Subsidiary,2010,Single Location,MASSACHUSETTS,999990,,,,,,99992222,"Duns Support Record, nonclassifiable establishment",$0 ,0,0,$0 
MASSACHUSETTS MUTUAL LIFE INSURANCE COMPANY,Massachusetts Mutual Life Insurance Co,Public,00-695-6049,Manufacturer,Non-Subsidiary,1851,Headquarters,MASSACHUSETTS,524113,Direct Life Insurance Carriers,524113,"""Direct Life Insurance Carriers """,6311,"""Life insurance""",63119906,Life insurance carriers,"$254,525,411,000 ","27,091","3,500","$15,029,470,960 "
"CARDINAL HEALTH, INC.",Cardinal Health Inc,Public,09-753-7435,Non Manufacturer,Non-Subsidiary,1979,Headquarters,OHIO,424210,Drugs and Druggists' Sundries Merchant Wholesalers,"339113, 423450, 424210, 561110","""Surgical Appliance and Supplies Manufacturing "", ""Medical, Dental, and Hospital Equipment and Supplies Merchant Wholesalers "", ""Drugs and Druggists' Sundries Merchant Wholesalers "", ""Office Administrative Services""","3842, 5047, 5122, 8741","""Surgical appliances and supplies"", ""Medical and hospital equipment"", ""Drugs, proprietaries, and sundries"", ""Management services""",51220308,Pharmaceuticals,"$145,534,000,000 ","49,500","2,800","$136,809,000,000 "
VERIZON COMMUNICATIONS INC.,Verizon Communications Inc,Public,10-721-2169,Manufacturer,Non-Subsidiary,1983,Headquarters,NEW YORK,443142,Electronics Stores,"443142, 517312","""Electronics Stores "", ""Wireless Telecommunications Carriers (except Satellite)""","4812, 5999","""Radiotelephone communications"", ""Miscellaneous retail stores, nec""",59990603,Telephone equipment and systems,"$131,868,000,000 ","135,000",400,"$130,863,000,000 "
WELLS FARGO & COMPANY,Wells Fargo & Co,Public,00-696-2435,Manufacturer,Non-Subsidiary,1929,Headquarters,CALIFORNIA,522110,Commercial Banking,522110,"""Commercial Banking """,6021,"""National commercial banks""",60210000,National commercial banks,"$103,915,000,000 ","259,800",122,"$101,060,000,000 "
TARGET CORPORATION,Target Corp,Public,00-696-1700,Manufacturer,Non-Subsidiary,1902,Headquarters,MINNESOTA,452210,Department Stores,"445110, 452210","""Supermarkets and Other Grocery (except Convenience) Stores "", ""Department Stores ""","5311, 5411","""Department stores"", ""Grocery stores""",53110000,Department stores,"$78,112,000,000 ","360,000",200,"$75,356,000,000 "
"METLIFE, INC.",MetLife Inc,Public,11-215-8568,Manufacturer,Non-Subsidiary,1863,Headquarters,NEW YORK,524113,Direct Life Insurance Carriers,"524113, 524114, 524126","""Direct Life Insurance Carriers "", ""Direct Health and Medical Insurance Carriers "", ""Direct Property and Casualty Insurance Carriers ""","6311, 6321, 6331","""Life insurance"", ""Accident and health insurance"", ""Fire, marine, and casualty insurance""",63119906,Life insurance carriers,"$69,620,000,000 ","49,000",16,"$67,941,000,000 "
HUMANA INC.,Humana Inc,Public,04-994-4143,Manufacturer,Non-Subsidiary,1961,Headquarters,KENTUCKY,524114,Direct Health and Medical Insurance Carriers,"524114, 524292","""Direct Health and Medical Insurance Carriers "", ""Third Party Administration of Insurance and Pension Funds ""","6321, 6324, 6411","""Accident and health insurance"", ""Hospital and medical service plans"", ""Insurance agents, brokers, & service""",63210102,Health insurance carriers,"$64,888,000,000 ","43,600",57,"$56,912,000,000 "
"PRUDENTIAL FINANCIAL, INC.",Prudential Financial Inc,Public,01-830-0884,Manufacturer,Non-Subsidiary,1875,Headquarters,NEW JERSEY,524113,Direct Life Insurance Carriers,"237210, 523120, 524113, 524126","""Land Subdivision "", ""Securities Brokerage "", ""Direct Life Insurance Carriers "", ""Direct Property and Casualty Insurance Carriers ""","6211, 6311, 6321, 6331, 6552","""Security brokers and dealers"", ""Life insurance"", ""Accident and health insurance"", ""Fire, marine, and casualty insurance"", ""Subdividers and developers, nec""",63210101,Accident insurance carriers,"$64,807,000,000 ","49,705","4,350","$62,992,000,000 "
PFIZER INC.,Pfizer Inc,Public,00-132-6495,Non Manufacturer,Non-Subsidiary,1942,Headquarters,NEW YORK,325411,Medicinal and Botanical Manufacturing,"325411, 325412","""Medicinal and Botanical Manufacturing "", ""Pharmaceutical Preparation Manufacturing ""","2833, 2834","""Medicinals and botanicals"", ""Pharmaceutical preparations""",28330300,Antibiotics,"$51,750,000,000 ","92,400","2,500","$53,647,000,000 "
"MACY'S, INC.",Macy'c Inc,Public,00-698-7135,Manufacturer,Non-Subsidiary,1830,Headquarters,OHIO,452210,Department Stores,452210,"""Department Stores """,5311,"""Department stores""",53119902,"Department stores, non-discount","$25,331,000,000 ","130,000",650,"$25,739,000,000 "
THE HARTFORD FINANCIAL SERVICES GROUP INC,Hartford The,Public,78-708-5893,Manufacturer,Non-Subsidiary,1810,Headquarters,CONNECTICUT,524113,Direct Life Insurance Carriers,"524113, 524114, 524126","""Direct Life Insurance Carriers "", ""Direct Health and Medical Insurance Carriers "", ""Direct Property and Casualty Insurance Carriers ""","6311, 6321, 6331, 6351","""Life insurance"", ""Accident and health insurance"", ""Fire, marine, and casualty insurance"", ""Surety insurance""",63110000,Life insurance,"$20,740,000,000 ","17,400",35,"$18,955,000,000 "
"MERRILL LYNCH & CO., INC.",Merrill Lynch Wealth Management,Public,06-496-8043,Manufacturer,Non-Subsidiary,0,Single Location,NORTH CAROLINA,523120,Securities Brokerage,"523120, 523140, 523930, 541910","""Securities Brokerage "", ""Commodity Contracts Brokerage "", ""Investment Advice "", ""Marketing Research and Public Opinion Polling""","6211, 6221, 6282, 8732","""Security brokers and dealers"", ""Commodity contracts brokers, dealers"", ""Investment advice"", ""Commercial nonphysical research""",62110000,Security brokers and dealers,"$20,217,000,000 ","56,200","10,000","$20,217,000,000 "
"MARSH & MCLENNAN COMPANIES, INC.",March & McLennan Co,Public,04-156-4378,Manufacturer,Non-Subsidiary,1871,Headquarters,NEW YORK,524210,Insurance Agencies and Brokerages,"523930, 524210","""Investment Advice "", ""Insurance Agencies and Brokerages ""","6282, 6411","""Investment advice"", ""Insurance agents, brokers, & service""",64110302,"Insurance brokers, nec","$16,652,000,000 ","76,000",300,"$14,950,000,000 "
"KRAFT FOODS GROUP, INC.",Kraft Foods Group Inc,Public,03-901-0590,Non Manufacturer,Non-Subsidiary,0,Single Location,ILLINOIS,311513,Cheese Manufacturing,,,,,20229902,Natural cheese,"$16,541,624,490 ","22,100",120,"$18,205,000,000 "
THE BANK OF NEW YORK MELLON CORPORATION,Bank of New York Mellon,Public,05-155-0713,Manufacturer,Non-Subsidiary,1784,Headquarters,NEW YORK,522110,Commercial Banking,522110,"""Commercial Banking """,6022,"""State commercial banks""",60220000,State commercial banks,"$16,462,000,000 ","52,500",300,"$16,392,000,000 "
THE GAP INC,Gap Inc,Public,04-862-6915,Manufacturer,Non-Subsidiary,1969,Headquarters,CALIFORNIA,448130,Children's and Infants' Clothing Stores,"448110, 448120, 448130, 448140, 448150","""Men's Clothing Stores "", ""Women's Clothing Stores "", ""Children's and Infants' Clothing Stores "", ""Family Clothing Stores "", ""Clothing Accessories Stores ""","5611, 5621, 5632, 5641, 5651","""Men's & boys' clothing stores"", ""Women's clothing stores"", ""Women's accessory & specialty stores"", ""Children's and infants' wear stores"", ""Family clothing stores""",56410000,Children's and infants' wear stores,"$16,383,000,000 ","135,000","2,500","$16,580,000,000 "
"NATIONWIDE FINANCIAL SERVICES, INC.",Nationwide Financial Services Inc,Public,96-641-8220,Manufacturer,Subsidiary,1996,Headquarters,OHIO,524113,Direct Life Insurance Carriers,"524113, 524298, 541611","""Direct Life Insurance Carriers "", ""All Other Insurance Related Activities "", ""Administrative Management and General Management Consulting Services ""","6311, 6411, 8742","""Life insurance"", ""Insurance agents, brokers, & service"", ""Management consulting services""",63110000,Life insurance,"$15,673,328,256 ","4,644",105,"$15,911,196,256 "
"NORDSTROM, INC.",Nordstrom Inc,Public,00-794-2915,Manufacturer,Non-Subsidiary,1901,Headquarters,WASHINGTON,448140,Family Clothing Stores,"448110, 448130, 448140, 448150, 448210, 454110","""Men's Clothing Stores "", ""Children's and Infants' Clothing Stores "", ""Family Clothing Stores "", ""Clothing Accessories Stores "", ""Shoe Stores "", ""Electronic Shopping and Mail-Order Houses ""","5611, 5632, 5641, 5651, 5661, 5961","""Men's & boys' clothing stores"", ""Women's accessory & specialty stores"", ""Children's and infants' wear stores"", ""Family clothing stores"", ""Shoe stores"", ""Catalog and mail-order houses""",56510000,Family clothing stores,"$15,132,000,000 ","68,000",97,"$15,860,000,000 "
"HEALTH NET, INC.",Health Net Inc,Public,79-833-0908,Manufacturer,Non-Subsidiary,0,Single Location,CALIFORNIA,524114,Direct Health and Medical Insurance Carriers,"524113, 524114","""Direct Life Insurance Carriers "", ""Direct Health and Medical Insurance Carriers ""","6311, 6324","""Life insurance"", ""Hospital and medical service plans""",63240000,Hospital and medical service plans,"$14,619,228,300 ","8,014",250,"$16,243,587,000 "
"RANDSTAD NORTH AMERICA, INC.",Tatum Division of Professional Services LLC,Private,09-951-4049,Manufacturer,Subsidiary,1994,Headquarters,GEORGIA,561320,Temporary Help Services,,,,,73630103,Temporary help service,"$13,777,671,599 ","225,700",404,"$17,038,586,833 "
TOYOTA MOTOR CREDIT CORPORATION,Toyota Motor Credit Corp,Public,12-202-8798,Manufacturer,Subsidiary,1983,Headquarters,TEXAS,441110,New Car Dealers,441110,"""New Car Dealers """,5511,"""New and used car dealers""",55119901,"Automobiles, new and used","$11,640,000,000 ","3,300",42,"$2,964,000,000 "
THE CHARLES SCHWAB CORPORATION,Charles Schaw & Co Inc,Public,00-130-7974,Manufacturer,Non-Subsidiary,1986,Headquarters,CALIFORNIA,523120,Securities Brokerage,"522320, 523120, 523930, 523991","""Financial Transactions Processing, Reserve, and Clearinghouse Activities "", ""Securities Brokerage "", ""Investment Advice "", ""Trust, Fiduciary, and Custody Activities ""","6091, 6211, 6282, 7389","""Nondeposit trust facilities"", ""Security brokers and dealers"", ""Investment advice"", ""Business services, nec""",62110102,"Brokers, security","$10,721,000,000 ","19,500",111,"$10,989,000,000 "
"HENRY SCHEIN, INC.",Henry Schein Inc,Public,01-243-0880,Manufacturer,Non-Subsidiary,1932,Headquarters,NEW YORK,423450,"Medical, Dental, and Hospital Equipment and Supplies Merchant Wholesalers","423450, 424210, 511210","""Medical, Dental, and Hospital Equipment and Supplies Merchant Wholesalers "", ""Drugs and Druggists' Sundries Merchant Wholesalers "", ""Software Publishers""","5047, 5122, 7372","""Medical and hospital equipment"", ""Drugs, proprietaries, and sundries"", ""Prepackaged software""",50470200,Dental equipment and supplies,"$9,985,803,000 ","22,000",700,"$13,201,995,000 "
PROGRESSIVE DIRECT INSURANCE COMPANY,Progressive Insurance,Private,80-581-8176,Manufacturer,Subsidiary,1986,Headquarters,OHIO,524126,Direct Property and Casualty Insurance Carriers,,,,,63319902,Automobile insurance,"$8,531,704,030 ",10,10,"$8,531,704,030 "
"DARDEN RESTAURANTS, INC.",Darden,Public,88-370-4959,Manufacturer,Non-Subsidiary,1968,Headquarters,FLORIDA,722511,Full-Service Restaurants,"533110, 722511","""Lessors of Nonfinancial Intangible Assets (except Copyrighted Works)"", ""Full-Service Restaurants ""","5812, 6794","""Eating places"", ""Patent owners and lessors""",58120802,Steak restaurant,"$8,510,400,000 ","180,000","1,400","$8,080,100,000 "
GOVERNMENT EMPLOYEES INSURANCE COMPANY INC,Government Employees Insurance Company,Private,00-691-9781,Manufacturer,Subsidiary,1937,Headquarters,MARYLAND,524210,Insurance Agencies and Brokerages,,,,,64110301,"Insurance agents, nec","$7,200,502,586 ","10,000","1,500","$6,337,661,394 "
"HSBC BANK USA, NATIONAL ASSOCIATION",HSBC Bank USA NA,Private,82-587-1820,Manufacturer,Subsidiary,1990,Headquarters,VIRGINIA,522110,Commercial Banking,,,,,60290000,"Commercial banks, nec","$6,522,507,000 ",17,17,"$5,722,339,000 "
"CONTINENTAL AIRLINES HOLDINGS, INC.",Continental Airlines,Private,03-789-7840,Manufacturer,Non-Subsidiary,0,Single Location,TEXAS,481111,Scheduled Passenger Air Transportation,,,,,45129902,"Air passenger carrier, scheduled","$5,575,239,000 ","39,400",26,$0 
THE NIELSEN COMPANY,Nielsen Co,Private,80-045-7801,Manufacturer,Non-Subsidiary,0,Single Location,NEW YORK,561499,All Other Business Support Services,,,,,73890100,"Personal service agents, brokers, and bureaus","$5,532,000,000 ","30,000","30,000","$5,532,000,000 "
PEARSON EDUCATION HOLDINGS INC.,Pearson Education Inc,Private,05-454-1771,Non Manufacturer,Subsidiary,1998,Headquarters,NEW YORK,511130,Book Publishers,,,,,27310204,Textbooks: publishing and printing,"$5,348,895,305 ","14,045","2,000","$5,269,300,578 "
NISOURCE INC.,NiSource-Bay State Gas Co,Public,18-565-4076,Manufacturer,Non-Subsidiary,1987,Headquarters,INDIANA,221118,Other Electric Power Generation,"221118, 486210","""Other Electric Power Generation "", ""Pipeline Transportation of Natural Gas""","4922, 4939","""Natural gas transmission"", ""Combination utilities, nec""",49390000,"Combination utilities, nec","$5,208,900,000 ","8,087",138,"$5,114,500,000 "
"BROADRIDGE FINANCIAL SOLUTIONS, INC.",Broadridge Financial Services,Public,60-853-7960,Manufacturer,Non-Subsidiary,1962,Headquarters,NEW YORK,518210,"Data Processing, Hosting, and Related Services","511210, 518210","""Software Publishers"", ""Data Processing, Hosting, and Related Services""","7372, 7374","""Prepackaged software"", ""Data processing and preparation""",73740000,Data processing and preparation,"$4,362,200,000 ","11,000",148,"$4,329,900,000 "
EQUIFAX INC.,Equifax Inc,Public,04-581-2369,Manufacturer,Non-Subsidiary,1899,Headquarters,GEORGIA,522320,"Financial Transactions Processing, Reserve, and Clearinghouse Activities","522320, 541910, 561110, 561450","""Financial Transactions Processing, Reserve, and Clearinghouse Activities "", ""Marketing Research and Public Opinion Polling"", ""Office Administrative Services"", ""Credit Bureaus""","7323, 7389, 8732, 8741","""Credit reporting services"", ""Business services, nec"", ""Commercial nonphysical research"", ""Management services""",73890900,Financial services,"$3,507,600,000 ","10,900",112,"$3,412,100,000 "
THE LINCOLN NATIONAL LIFE INSURANCE COMPANY,Lincoln National Life Insurance Company,Private,00-699-6763,Manufacturer,Subsidiary,2007,Headquarters,INDIANA,524113,Direct Life Insurance Carriers,,,,,63110000,Life insurance,"$2,213,388,918 ","8,000",200,"$2,012,171,744 "
"WYNDHAM HOTELS & RESORTS, INC.",Wyndham Hotels and Resorts LLC,Public,08-127-6759,Manufacturer,Non-Subsidiary,2017,Headquarters,NEW JERSEY,721110,Hotels (except Casino Hotels) and Motels,,,,,70110302,"Hotel, franchised","$2,053,000,000 ","16,200",72,"$1,868,000,000 "
SAKS INCORPORATED,Saks Inc,Public,00-894-2252,Manufacturer,Subsidiary,1919,Headquarters,NEW YORK,452210,Department Stores,"448110, 448120, 448130, 452210","""Men's Clothing Stores "", ""Women's Clothing Stores "", ""Children's and Infants' Clothing Stores "", ""Department Stores ""","5311, 5611, 5621, 5641","""Department stores"", ""Men's & boys' clothing stores"", ""Women's clothing stores"", ""Children's and infants' wear stores""",53110000,Department stores,"$1,913,956,900 ","13,900",900,"$1,964,715,251 "
FIRST-CITIZENS BANK & TRUST COMPANY,First Citizens Bank,Private,00-320-2975,Manufacturer,Subsidiary,1898,Headquarters,NORTH CAROLINA,522110,Commercial Banking,,,,,60220000,State commercial banks,"$1,784,792,000 ","4,821",250,"$1,741,456,000 "
THE WENDY'S COMPANY,Wendys Co,Public,00-503-8773,Manufacturer,Non-Subsidiary,1929,Headquarters,OHIO,722513,Limited-Service Restaurants,"533110, 722513","""Lessors of Nonfinancial Intangible Assets (except Copyrighted Works)"", ""Limited-Service Restaurants ""","5812, 6794","""Eating places"", ""Patent owners and lessors""",58120307,"Fast-food restaurant, chain","$1,709,002,000 ","12,100",475,"$1,589,936,000 "
MERCANTILE BANK NATIONAL ASSOCIATION,Mercantile Bank,Private,00-696-7996,Manufacturer,Non-Subsidiary,0,Single Location,MISSOURI,522110,Commercial Banking,,,,,60210000,National commercial banks,"$1,491,694,000 ","3,399","1,200","$1,491,694,000 "
"PITT COUNTY MEMORIAL HOSPITAL, INCORPORATED",Pitt County Memorial Hospital,Private,05-640-3462,Manufacturer,Subsidiary,1953,Headquarters,NORTH CAROLINA,622110,General Medical and Surgical Hospitals,622110,"""General Medical and Surgical Hospitals """,8062,"""General medical & surgical hospitals""",80629903,"Hospital, medical school affiliated with residency","$1,201,287,000 ","15,000","11,000","$1,201,287,000 "
"GENTIVA HEALTH SERVICES, INC.",Gentiva Health Services,Public,12-974-1026,Manufacturer,Non-Subsidiary,1999,Headquarters,GEORGIA,621610,Home Health Care Services,621610,"""Home Health Care Services""",8082,"""Home health care services""",80820000,Home health care services,"$1,132,851,128 ","39,200",150,"$1,726,644,000 "
RBC BANK (USA),RBC Bank,Private,62-020-0006,Manufacturer,Non-Subsidiary,0,Single Location,NORTH CAROLINA,522110,Commercial Banking,,,,,60220000,State commercial banks,"$1,118,053,000 ","4,466",58,"$1,368,963,000 "
"LENDINGTREE, INC.",Lending Tree,Public,82-818-4429,Manufacturer,Non-Subsidiary,2008,Headquarters,NORTH CAROLINA,522310,Mortgage and Nonmortgage Loan Brokers,"522310, 531210","""Mortgage and Nonmortgage Loan Brokers "", ""Offices of Real Estate Agents and Brokers""","6163, 6531","""Loan brokers"", ""Real estate agents and managers""",61630000,Loan brokers,"$1,106,603,000 ",909,38,"$764,865,000 "
SUNGARD AVAILABILITY SERVICES LP,Sungard Availability Services (SAS),Private,08-476-4836,Manufacturer,Non-Subsidiary,2000,Headquarters,PENNSYLVANIA,518210,"Data Processing, Hosting, and Related Services",518210,"""Data Processing, Hosting, and Related Services""",7374,"""Data processing and preparation""",73740100,Computer processing services,"$1,060,200,000 ","1,000",150,"$1,178,000,000 "
CRAWFORD & COMPANY,Crawford and Co,Public,04-100-7717,Manufacturer,Non-Subsidiary,1941,Headquarters,GEORGIA,524291,Claims Adjusting,"524126, 524291, 541110, 621999","""Direct Property and Casualty Insurance Carriers "", ""Claims Adjusting "", ""Offices of Lawyers"", ""All Other Miscellaneous Ambulatory Health Care Services ""","6331, 6411, 8099, 8111","""Fire, marine, and casualty insurance"", ""Insurance agents, brokers, & service"", ""Health and allied services, nec"", ""Legal services""",64110200,Insurance adjusters,"$1,047,627,000 ","9,190",700,"$1,122,979,000 "
"BNY MELLON, NATIONAL ASSOCIATION",BNY Mellon co,Private,00-791-6018,Manufacturer,Subsidiary,1869,Headquarters,PENNSYLVANIA,522110,Commercial Banking,,,,,60210000,National commercial banks,"$996,967,000 ","7,662",10,"$996,967,000 "
TRUSTEES OF BOSTON COLLEGE,Boston College,Private,04-589-6339,Manufacturer,Non-Subsidiary,1863,Headquarters,MASSACHUSETTS,611310,"Colleges, Universities, and Professional Schools",611310,"""Colleges, Universities, and Professional Schools """,8221,"""Colleges and universities""",82210101,"College, except junior","$835,632,000 ","2,493",18,"$835,632,000 "
"CROSS COUNTRY HEALTHCARE, INC.",Cross Country Healthcare Inc,Public,08-242-3377,Manufacturer,Non-Subsidiary,1996,Headquarters,FLORIDA,561311,Employment Placement Agencies,"561311, 561320","""Employment Placement Agencies "", ""Temporary Help Services""","7361, 7363","""Employment agencies"", ""Help supply services""",73610204,Nurses' registry,"$822,224,000 ","7,397","1,800","$816,484,000 "
TITANIUM METALS CORPORATION,Titanium Metals Corp,Private,04-182-9318,Non Manufacturer,Subsidiary,1950,Headquarters,OHIO,331491,"Nonferrous Metal (except Copper and Aluminum) Rolling, Drawing, and Extruding",,,,,33560600,Titanium,"$757,888,143 ","2,750",30,"$757,888,143 "
NATIONAL CITY BANK OF PENNSYLVANIA,National City Bank,Private,80-340-2874,Manufacturer,Non-Subsidiary,0,Single Location,PENNSYLVANIA,522110,Commercial Banking,,,,,60220000,State commercial banks,"$661,586,000 ","4,307",500,"$661,586,000 "
"SAVE THE CHILDREN FEDERATION, INC.",Save the Children,Private,07-212-9919,Manufacturer,Non-Subsidiary,1932,Headquarters,CONNECTICUT,624190,Other Individual and Family Services,"453220, 624190","""Gift, Novelty, and Souvenir Stores "", ""Other Individual and Family Services ""","5947, 8322","""Gift, novelty, and souvenir shops"", ""Individual and family services""",83220610,Social service center,"$652,021,338 ","3,000",276,"$652,021,338 "
LOYOLA UNIVERSITY OF CHICAGO INC,Loyola University of Chicago,Private,07-436-8911,Manufacturer,Non-Subsidiary,1870,Headquarters,ILLINOIS,611310,"Colleges, Universities, and Professional Schools",611310,"""Colleges, Universities, and Professional Schools """,8221,"""Colleges and universities""",82210102,University,"$614,155,000 ","10,500","1,100","$594,785,000 "
"CITIMORTGAGE, INC.",CitiMortgage Inc,Private,09-794-2163,Manufacturer,Subsidiary,1978,Headquarters,MISSOURI,522292,Real Estate Credit,,,,,61629903,Mortgage bankers,"$612,861,502 ","4,900","1,000","$562,446,439 "
"FRANKLIN TEMPLETON INVESTOR SERVICES, LLC",Franklin Templeton Investments,Private,19-469-3503,Manufacturer,Subsidiary,1981,Headquarters,CALIFORNIA,523999,Miscellaneous Financial Investment Activities,,,,,62110109,"Traders, security","$576,740,103 ","2,500","1,200","$608,961,077 "
AMERICAN HOME ASSURANCE CO INC,American Home Assurance,Private,00-697-9959,Manufacturer,Subsidiary,1899,Headquarters,NEW YORK,524126,Direct Property and Casualty Insurance Carriers,,,,,63319907,Property damage insurance,"$575,423,620 ","2,800",608,"$640,079,150 "
"CAROMONT HEALTH, INC.",CaroMont Health,Private,62-205-8519,Manufacturer,Non-Subsidiary,1984,Headquarters,NORTH CAROLINA,561110,Office Administrative Services,"561110, 621498, 622110","""Office Administrative Services"", ""All Other Outpatient Care Centers "", ""General Medical and Surgical Hospitals ""","8062, 8093, 8741","""General medical & surgical hospitals"", ""Specialty outpatient clinics, nec"", ""Management services""",87419907,Nursing and personal care facility management,"$510,637,401 ","2,400","1,900","$602,656,507 "
"MASSACHUSETTS EYE AND EAR INFIRMARY & PHYSICIAN STAFF, INC.",Massachusetts Eye and Ear Infirmary Inc,Private,07-382-5945,Manufacturer,Subsidiary,1988,Headquarters,MASSACHUSETTS,622310,Specialty (except Psychiatric and Substance Abuse) Hospitals,,,,,80699902,"Eye, ear, nose, and throat hospital","$486,406,606 ","1,550","1,000","$441,603,815 "
